text,mergedTextualRating,month
The magazine’s Ethicist columnist on balancing animal welfare and a family’s need for income.,true,9
Food stamp recipients can get a free passport,false,7
"Bryant, the N.B.A. star who died in a helicopter crash in 2020, was known for using No. 24 as one of his jersey numbers while playing for the Los Angeles Lakers.",true,9
"In a region with a history of genocide, weeks of intense fighting between rival military factions in South Darfur have left hundreds dead and sent thousands fleeing.",true,9
Video shows John F. Kennedy Jr. at Donald Trump’s presidential inauguration.,false,1
2022 Hunga Tonga-Hunga Ha’apai volcanic eruption most deadly 'of all time,false,12
The entire island of Maui is bracing for the return of tourism even as disaster relief efforts continue. The path to recovery is uncertain.,true,10
"Kenneth Chesebro, an architect of the plan to deploy people claiming to be Trump electors in states won by President Biden, is cooperating with inquiries in Michigan, Arizona and Nevada.",true,12
Andrew Tate was released from prison and “proven not guilty.”,false,2
"Jessica Karcher’s son, Justin, was shot four times and is in critical condition at Central Maine Medical Center in Lewiston.",true,10
"Legally, a co-op board president can work as a lawyer for shareholders selling their units, but that doesn’t make it a good idea.",true,1
"The 1911 fire at the Triangle Shirtwaist Factory in New York killed 146 workers, mostly young immigrant women, and galvanized the U.S. labor movement.",true,10
UK government approved plan to forcibly vaccinate citizens.,false,5
The cream rose in finding this week’s most challenging word.,true,9
"A 40-mile channel, best known outside shipping circles as a magnet for bird watchers, is now a crucial route allowing Ukrainian grain to reach the sea, protected by a NATO umbrella.",true,8
The fighting between Israel and Hamas has raised fears that the violence will spill into Lebanon as a wider conflict with Hezbollah. Such a war would be dangerous for all involved.,true,10
“There are polls that also say I have great approval ratings.”,false,7
"“We used to rank No. 1 in the world in research and development, now we rank No. 9. China used to rank No. 8, now it ranks No. 2.”",false,1
"Joe Drape, The Times’s “turf writer,” is just as entranced by horse racing as his predecessors were.",true,5
"A slice of voters would vote for Vice President Harris but not President Biden, reflecting his challenges and opportunities.",true,11
"Two years of spending caps, additional work requirements for food stamps and cuts to I.R.S. funding are among the components in the deal.",true,5
"If phone users in the U.K. do not acknowledge or reply to an emergency text alert test on April 23, 2023, their phones will be locked by the U.K. government for the day.",false,3
"A night of art and pizza with Lyora Pissarro, descendant of the “father of Impressionism.”",true,4
Kansas City Chiefs quarterback and Super Bowl LVII MVP Patrick Mahomes was caught taking male enhancement supplements.,false,2
The teenage winner of our Invent a Word challenge suggests a word for distinguishing between human- and machine-generated responses in the era of chatbots.,true,4
"Almost every study now has said with these new boosters, you're more likely to get infected with the bivalent booster.",false,2
"Videos that surfaced in November 2023 accurately reported that actor Joe Alwyn ""furiously"" reacted to singer Taylor Swift dating football player Travis Kelce.",false,11
"Family trees have been dismembered, and whole branches obliterated, since the war between Israel and Hamas broke out on Oct. 7.",true,12
People identifying as dogs protested for 'trans species' rights,false,9
Arkansas will cover cost of installing solar panels for eligible homeowners,false,12
"An image shared on Oct. 10, 2023, authentically depicted the Gaza Strip left in ruins by Israeli reprisal attacks.",true,10
"A judge with a liberal background and significant criminal trial experience, Tanya S. Chutkan swiftly ruled against the former president in his 2021 attempt to keep White House papers secret from the congressional inquiry.",true,8
"Former President Donald Trump said, “Israel has hypnotized the world.”",false,10
"Exclusively from New York Times Audio, our new app.",true,6
"Ms. Stein will seek the Green Party nomination, a spokesman said. Her last two campaigns with the party were unsuccessful.",true,11
“NASA admits space and planets are fake.”,false,11
American and Ukrainian defense officials said the fight to dislodge dug-in Russian forces occupying southeastern Ukraine was expected to be brutal.,true,6
Video shows Hamas “paraglided amongst Israeli citizens and proceeded to massacre them.”,false,10
"“In Congress, Ron DeSantis backed a national sales tax — a 23 percent tax hike on almost everything you buy.",false,5
Take these small steps to lower your exposure.,true,2
"Supporters and opponents of former President Donald J. Trump gathered in Lower Manhattan on Tuesday, galvanized by his impending arraignment.",true,4
"“This also is the largest cut that Congress has ever voted on, more than $2.1 trillion.”",false,5
"“We had Intel come along and say, 'Look, we’re going to invest there.' ... And guess what the average pay is? About 100- to 110,000 bucks a year. And you don’t need a college degree to have the job.",false,10
“How are we supposed to get our girls used to the fact that biological boys are in their locker rooms? And then we wonder why a third of our teenage girls seriously contemplated suicide last year.”,false,6
The automaker saw a big jump in deliveries of pickup trucks as demand from consumers and businesses remained strong.,true,7
"Surprising ascensions, Hollywood migrations and daggers to the art — it’s all part of life at the top.",true,11
"The animals, observed floating off Long Island and Staten Island this week, were the latest casualties of a species that faces many threats.",true,6
NOAA makes it official. Last 8 years... global cooling.,false,1
"The family friendly online role-playing game Poptropica announced on Discord that it would be shutting down after Dec. 29, 2023.",false,12
Russian President Vladimir Putin “warns ‘global terrorist’ Klaus Schwab his ‘days are numbered.’”,false,10
“We eliminated critical race theory from our K through 12 schools.”,false,8
"As a sitting Supreme Court justice, Daniel Kelly recused himself from a case, then “he pocketed $20,000 in contributions” from the plaintiff and family members and “unrecused himself so he could judge the case.”",false,3
"Robyn Epps, the wife of a Jan. 6 participant, works for Dominion",false,8
"Yevgeny V. Prigozhin, once a caterer for the Kremlin, has made capturing the city a personal obsession.",true,5
"The legislation, which includes an exemption for people already receiving treatment, now goes to the desk of the Republican governor.",true,5
Adam Schiff is being impeached,false,4
"Exclusively from New York Times Audio, our new app.",true,8
"Samsung once used a “butt robot” — i.e., a device in the shape of human glutes — to apply pressure on cell phones in development to test their durability.",true,9
"“This is the most insane thing ever,” said the man who unearthed the coins in a cornfield, according to a video posted last month.",true,7
Rebuses are crossword elements where solvers are asked to write multiple letters in the same square. Here’s how to do that on your devices.,true,12
Images of Raila Odinga in UK bilateral talks,false,8
Prosecutors are investigating war crimes against Americans but are mainly focused on helping Ukraine to hold Russians accountable for atrocities.,true,3
"U.S. House Speaker Kevin McCarthy signaled to GOP hecklers including, on multiple occasions, Rep. Marjorie Taylor Greene, to be quiet during the 2023 State of the Union address.",true,2
"Barcodes beginning with 729, 841 and 871 denote goods from Israel",false,12
"Man-grasshopper hybrids, not-quite space travel and very brief time travel in this month’s collection of sci-fi picks.",true,10
"An online video accurately reports that actor Dwayne Johnson, better known as The Rock, and entertainment icon Oprah Winfrey had a ""shady role"" in the August 2023 Maui wildfires.",false,9
"HPV vaccines are ineffective and cause side effects including autoimmune and neurological disorders, based on VAERS reports",false,11
"Elon Musk appeared as himself in ""Iron Man 2.",true,7
“the number 1 indicator of parasites is actually an autoimmune condition”,false,6
Los Angeles Dodgers Stadium is flooded after mocking God!”,false,8
"Burned out from life in New York, a photographer traveled to northern Chile to study the ancient wisdom of the Lickanantay, the area’s Indigenous people. Here’s what she saw.",true,11
"Come up with your own addition to the English language. Suggest a new word by Feb. 28, and it could become our April Fools’ Word of the Day.",true,2
"An 1860 Victorian in Dorset, a 1912 Craftsman house in Kansas City and a renovated 1890 home in Columbus.",true,10
This episode reflects that this season is about women carving out a place for themselves in a world where the best men are dim and the worst are abusive.,true,12
The emergency alert will access your personal data.,false,3
Rise in cancer after water fluoridation was introduced shows fluoride causes cancer; “Fluoride amounts to public murder on a grand scale”,false,5
"The CEO of Moderna ""admitted"" during the 2023 World Economic Forum meeting in Davos that the company was making a COVID-19 vaccine in January of 2020 ""before SARS-CoV-2 even had a name.",false,1
"From apple picking to skeleton cows, early seasonal spending seems solid. It’s the latest sign that Federal Reserve policy to combat inflation hasn’t slowed growth.",true,10
“DeSantis even voted to fast-track Obama’s Chinese trade deals.”,false,10
Image shows Nashville shooter's bedroom,false,3
A bill in Connecticut that changes the definition for “sexual orientation” would protect “minor attracted persons” from discrimination.,false,5
"Seung Song said his identity was stolen and used to buy $5,000 worth of gun components from an online dealer using a buy now, pay later service.",true,3
Police evacuated Jewish students from UC San Diego due to anti-Israeli mob,false,11
A renewed focus on fiscal restraint in the debt limit standoff with Democrats poses its own political risks.,true,1
"Through the first few hours of Donald J. Trump’s time on the witness stand, he and Judge Arthur F. Engoron traded irritated facial expressions.",true,11
"Video shows officials in Maricopa County, Arizona, ""illegally breaking into"" voting machines.",false,5
"Leaders in Seoul need assurances that the United States would offer support in the face of any aggressive response from China or Russia, Prime Minister Mateusz Morawiecki said.",true,4
"NASA is “just a film studio, and all they do are movies.”",false,5
Feeling stuck on today’s puzzle? We can help.,true,4
"U.S. House Speaker Mike Johnson ""opposes Social Security benefits.",false,10
“One in 5 Americans has lost a family member to gun violence.”,true,4
A.I. chatbots can do a passable job of generating short essays. Whether their use on college applications is ethical is the subject of fierce debate.,true,9
"Video of the Indonesian ruling party PDI-P's members endorsing rival presidential candidate, Anies Baswedan",false,9
The agreement all but ends one of the longest labor crises in the history of the entertainment industry. Union members still have to approve the deal.,true,11
"A photograph shows a genuine “crab-like” human skeleton recovered from ""Le Lanchon experiments"" on human evolution.",false,9
"At a bar in a once-occupied Ukrainian village, dehumanizing messages on the walls were a stark reminder that the Kremlin wants to stamp out Ukraine and its culture.",true,6
His death after he was beaten by the police inspired anger and sorrow across the country. His family remembers him as a “beautiful soul.”,true,2
"At a time when Israeli Jews can seem irreconcilably divided, an unusual swimming center in the city of Rehovot illustrates the compromises that many Israelis make daily.",true,8
“When fentanyl burns it smells like popcorn.”,false,4
The Ner Tamid Society within the New York Fire Department is growing for the first time in decades. Members say its purpose has taken on new urgency.,true,11
The number of Japanese businesses in North Brooklyn has grown in recent years. The food is worth your time.,true,7
"No corrections appeared in print on Sunday, April 16, 2023.",true,4
"Throughout Mexico, the veteran architect Alberto Kalach creates spare dwellings that respond to the landscape around them.",true,9
"Pete Maravich’s career mark has stood for more than 50 years, but the pandemic and the 3-pointer have put Detroit Mercy’s Antoine Davis within reach of the crown.",true,3
"Even before its two leading generals went to war last week, “everyone wanted a chunk of Sudan,” an expert said of the strategically located country rich in natural resources.",true,4
The deal for Creative Artists Agency by François-Henri Pinault’s family office reflects the growing convergence of celebrities and fashion.,true,9
"Senator Richard Blumenthal, asserting that gambling causes “very real harm” to students, has asked 66 colleges to provide information about their marketing relationships with sportsbooks.",true,3
"The Nashville, Tennessee, school shooter was Samantha Hyde.",false,3
"In Chile, a writer takes a road trip through one of the world’s driest places — a landscape that preserves remnants of the dead.",true,5
"A photograph authentically shows a skyscraper-sized ad with the text, ""We're putting cum inside M&M's.",false,5
Video shows footage of recent violence in Israel.,false,10
Protestors in France have released animals from the zoo.,false,7
"With a ghostly finger in a lab, researchers coaxed people to hear phantom voices.",true,10
"Leaders from OpenAI, Google DeepMind, Anthropic and other A.I. labs warn that future systems could be as deadly as pandemics and nuclear weapons.",true,5
Biden stranded a lot of American citizens over there who were trying to get home.,false,11
"A YouTube video posted in September 2023 accurately reported that actress Christina Ricci said fellow actor Ashton Kutcher ""should be jailed.",false,9
COVID-19 vaccines are responsible for the rise in heart attacks in young people,false,2
“There have been more illegal encounters under Biden than the previous two administrations combined.,false,7
Republicans in Congress are “trying to wipe out federal funding to end the HIV epidemic.”,false,10
"Roomy, neutral accessories that go with everything.",true,10
Where in the world would you most like to travel?,true,4
Georgia forced the Horned Frogs into plenty of bad plays. But T.C.U. showed unusual flaws compared with its previous games this season.,true,1
The German government said investigating COVID-19 vaccines would be dangerous for democracy.,false,1
Video shows Trump rally related to arrest rumor,false,3
"Photograph authentically shows a rock in Finland weighing 500,000 kilograms (1.1 million pounds), balanced on top of another rock for 11,000 years.",false,5
“Donald Trump arrested” July 5.,false,7
The former president is seeking the full court’s review after a three-judge panel upheld a gag order imposed by the trial court but narrowed its scope.,true,12
Video shows cartel kidnapping doctors following arrest of Ovidio Guzmán,false,1
"Microsoft and Alphabet will report results on Tuesday, as investors look for signs that a rally in stocks tied to artificial intelligence is justified.",true,7
"Several leading scholarly groups have criticized the Museum of the American Revolution in Philadelphia for renting space to the group, which has pushed for book bans.",true,6
"Subpoenaed bank records that show Hunter Biden’s business entity, Owasco PC, made direct monthly payments to Joe Biden.",false,12
"The 1959 movie ""Some Like It Hot"" was banned in Tennessee in March 2023 as a result of a new state law banning ""adult cabaret performances"" that feature male or female impersonators.",false,3
"“the COVID vaccines have killed millions of people worldwide, an estimated 1 death per 1,000 doses on average in a standard population”",false,8
"Andrew Intrater, a wealthy businessman, has been in touch with the S.E.C. about Mr. Santos’s dealings on behalf of a company accused in a Ponzi scheme.",true,1
"Nearly a third of all shoplifting arrests in the city last year involved just 327 people, the police said. Businesses say they have little defense.",true,4
Trans activists deemed Aretha Franklin's song 'Natural Woman' offensive,false,1
The judge said that a state law requiring voters to date the return envelope violated the voting protections of the Civil Rights Act.,true,11
Video of Hunter Biden at the White House was taken on the “same day they found cocaine.”,false,7
Video shows parents of suspect in killing of Jullebee Ranara,false,1
An interview with the “Golden Bachelor.” Also: Las Vegas is reinventing itself again and Stephen Sondheim’s final musical.,true,9
More athletes died from cardiac arrest from 2021-2022 than from 1966-2004,false,1
"“In every single war that America has fought, we have never asked for land afterwards, except for enough to bury the Americans who gave the ultimate sacrifice for that freedom we went in for.”",false,11
"Before the pandemic, turning a house into a hub for big gatherings seemed like a good idea.",true,1
“How to Blow Up a Pipeline” is a thriller rooted in a timely fear: We do not know how the future will see us.,true,4
"Four Nigerian stowaways hopped on a cargo ship not knowing where it was going, but hoping to find a place where they could claw out of poverty.",true,8
"Videos that surfaced in November 2023 accurately reported that actor Matthew Perry's ex-girlfriend claims he didn't drown, despite rumors to the contrary, and ""reveals truth about last days.",false,11
Video shows Rep. Alexandria Ocasio-Cortez cry on CNN over Rep. Jamal Bowman,false,10
The Transportation Security Administration spent “a couple hundred million dollars” on gender-neutral screening technology.,false,1
"“I have been a state legislator for 11 years, passing over 170 bills into law and delivering for Wisconsin families.”",true,11
"At least 1,200 protesters were detained for questioning in the wake of the storming of Brazil’s capital buildings, a spokesman for the civil police said on Monday, as the authorities began dismantling the tent city where supporters of Jair Bolsonaro, the far-right former president, had been camping out since he lost October’s election.",true,1
Gov. Ron DeSantis “actually sponsored the bill to make Puerto Rico a state.”,true,10
“Three minutes ago Trump cries after losing everything after new evidence exposed.”,false,9
"“Biden is giving each illegal family $2,200 per month plus a free plane ticket and free medical care.",false,9
“‘Satellites’ are on balloons and not in space.”,false,2
The famously stylish former president of J. Crew has joined the rebooted “Real Housewives of New York City.” Why?,true,6
"For decades, the soon-to-retire “Wheel of Fortune” host was … just there. That was the whole point of him.",true,6
"A YouTube video posted in October 2023 accurately reported that actor Rachel Zegler, the star of Disney's live-action adaptation of ""Snow White,"" ""raged"" after being ""roasted"" by Daily Wire's ""Snow White"" remake and said, ""Mine was better.",false,10
"Tension between the city and its surrounding areas over issues like crime, immigration and congestion pricing has grown since the pandemic.",true,6
"For mother and daughter, their relationship has been one of mutual — but not stifling — dependence.",true,4
"President Vladimir V. Putin of Russia falsely claimed the material had a “nuclear component.” Many armies, including Russia’s, use it in weapons.",true,3
"In a simulation, an AI-enabled drone operated by the U.S. Air Force killed its operators and “started taking out communication towers.”",false,6
"It’s a fact that those who perform well on math & reading tests tend to perform more poorly on the 1-mile run, and vice versa.",false,8
Looking for darkness in Australia’s biggest state.,true,4
"Volcanic São Miguel, one of the nine islands in this Portuguese archipelago in the Mid-Atlantic, offers landscapes and experiences that are at once wild and serene.",true,7
A three-day bout of extreme weather in the Northeast is sending temperatures 20 degrees higher than usual.,true,9
"Mariupol State University, an oasis amid the war, has graduated its newest class, more than a year after fleeing its devastated home city.",true,7
Image shows a fall revealing President Joe Biden’s diaper.,false,6
A software company's contract allows officials to override election results,false,9
They said they were willing to proceed to trial in October without pursuing charges they filed after Mr. Bankman-Fried was extradited from the Bahamas.,true,6
A reader wonders how best to call out male friends and co-workers when they dismiss her assessments of her own health.,true,10
Muslim man arrested over fatal stabbbing of Delhi policeman,false,1
The GOP approved a resolution to remove Ilhan Omar from Congress,false,2
"FIFA, the governing body for international football competition, will keep Pele's feet in its museum.",false,1
A photograph from the 1930s shows the last public execution held in the United States.,true,4
Video shows House Speaker Kevin McCarthy announcing U.S. Rep. Nancy Pelosi “will be impeached.”,false,5
"Mr. Ramaswamy becomes the second G.O.P. presidential candidate to agree to such a debate, with the governors of Florida and California also set to debate.",true,10
"Nancy Marks, Mr. Santos’s former campaign treasurer, has her own history of questionable dealings that have aroused interest from federal investigators.",true,4
"Alli Smith, del Laboratorio de Ornitología de la Universidad Cornell, ofrece consejos para que los principiantes comiencen a explorar el vasto mundo de las aves.",true,7
North Carolina tornado destroyed Pfizer warehouse full of COVID-19 vaccines,false,7
‘No correlation’ between carbon dioxide emissions and the climate,false,2
"Policymakers approved a quarter-point increase, to 4.25 percent, while affirming that British banks were “resilient.”",true,3
Nassau County glitch turned every single registered voter Democrat,false,5
"From a slyly clueless documentary presenter to a soulful pair of private eyes, here are the latest trans-Atlantic imports.",true,2
The crew’s 10-day journey around the moon and back in 2024 is a crucial step toward returning Americans to the moon on a sustained basis.,true,4
"Wealthy Democrats have thrown their money behind the president’s re-election bid, but for many reasons, the party’s small donors have yet to step up their contributions.",true,7
The visits by the Ukrainian and Russian leaders came as both sought to display strength and confidence ahead of an anticipated Kyiv counteroffensive.,true,4
Video of howling people in Germany shows “trans species rights” protest.,false,10
Mike Johnson said women have ‘a duty’ to give birth to workers,false,10
"HIV drug AZT, backed by Fauci, killed hundreds of thousands of people",false,6
This word has appeared in 213 articles on NYTimes.com in the past year. Can you use it in a sentence?,true,4
Video shows Chuck Grassley give FBI director 'jailtime,false,6
“#Bidenomics has led to mortgage rates hitting a 21-year high → over 7%.”,true,8
"John Vaillant, the author of “Fire Weather” (one of our 10 Best Books this year), discusses climate change and the fire that devastated a Canadian petroleum town in 2016.",true,12
"More than 24,000 people in India died from 2023 heatwave",false,4
"The grocery delivery company priced its offering at the high end of expectations, in a potentially upbeat sign for tech public offerings.",true,9
The New York Dippers Club meets every morning to plunge into icy cold water. Is that something you would want to do?,true,2
"Arcade, a new project by Classical California, aims to dispel preconceptions about classical music and video game soundtracks.",true,11
"Tashnuva Anan Shishir, who became her country’s first transgender news anchor in 2021, is performing in “Public Obscenities” at Soho Rep.",true,3
"Unlike a criminal trial, where a jury has to reach a unanimous verdict, a grand jury can issue an indictment with a simple majority. Grand jurors hear only from prosecutors and the witnesses they present.",true,8
A video shows banned books in Florida,false,5
"The ingestion of edibles by children under 6 has risen rapidly since the start of the pandemic, contributing to a “significant increase” in hospitalizations, the study found.",true,1
"A printer error in Nassau County, New York, turned every registered voter Democratic.",false,5
Video showing Pakistani immigrants drowning off Libya.,false,2
One of Brigham Young's sons was a drag queen.,true,3
The American arts-and-crafts retail chain Hobby Lobby discontinued Hanukkah merchandise and did not offer products associated with the Jewish holiday in 2023.,true,11
Video of building collapse due to Turkey earthquake in 2023,false,2
Kenya hikes second-hand clothing tax in 2023,false,3
"[T]he two Democrat Senators in Delaware, they got to choose and/or approve"" David Weiss as U.S. Attorney for Delaware.",false,7
Donald Trump purchased a handgun in South Carolina,false,9
“Haaretz investigation reveals discrepancies in Israel’s reporting on October 7th death toll.”,false,10
