text,mergedTextualRating,month
“We’re seeing two massive explosions on U.S. critical infrastructure in the past 24 hours that have caused power outages.”,false,8
"A photograph authentically shows former U.S. President Donald Trump's police mugshot from April 4, 2023, that media outlets weren't reporting on.",false,4
The ceremony honoring Broadway’s top shows and performers will take place at the majestic former “Wonder Theater” in Washington Heights.,true,6
"Aluminum, mercury in vaccines cause autism; aluminum exceeds safe limit",false,12
Video of Putin saying he will not resign in 2023,false,2
"We were lied about “COVID-19 numbers”, treatments, natural immunity, and the origin of the virus; COVID-19 vaccines and control measures “didn’t work”",false,2
"Mozart so disliked a soprano whose head bobbed up and down when she sang that he wrote an aria meant to make her ""bob like a chicken.",false,2
Babies can’t have water before they’re 6 months old,true,2
The spike protein induced by COVID-19 vaccines is toxic and causes diseases and deaths; nattokinase can counter these effects,false,3
"“I’m ashamed to say I picked up W. Somerset Maugham’s ‘Of Human Bondage’ because the title seemed promising,” says the doctor and novelist, whose new novel is “The Covenant of Water.” “While it didn’t have the lascivious content I’d imagined, it turned out to have something better: It was the book that … called me to medicine.”",true,4
The deliveries of advanced equipment are expected to assist Kyiv with a potential spring offensive.,true,3
Disney CEO Bob Iger announced that Disney+ would be shutting down in December 2023.,false,11
"Malaysian palace angered by corruption cases involving chief secretary, public service DG",false,4
Wildfires in western Canada are expected to create smoky conditions in the United States this week. Parts of the U.S. had unhealthy air in June from wildfires in other parts of Canada.,true,7
A photo authentically depicts Donald Trump and wealthy financier Jeffrey Epstein together in 2000.,true,12
The justices struggled to decide how to deal with documents that include both legal and business advice.,true,1
AI drone killed human operator in military simulation,false,6
Arizona state legislature banned electronic voting machines.,false,5
Posts suggest an increase in infant mortality from 2021 to 2022 is linked to the COVID-19 vaccines.,false,11
"Video of falling Palestinian man is staged, from 2023 Israel-Hamas conflict",false,12
“Arizona BANS Electronic Voting Machines.”,false,5
This word has appeared in 215 articles on NYTimes.com in the past year. Can you use it in a sentence?,true,5
"In July 2023, during protests over the police shooting of a teenager, France announced it was restricting internet access.",false,7
"Two videos authentically showed that some naked men participated in the June 2023 Seattle Pride Parade and also bathed in International Fountain, in both instances with families and children present.",true,6
"“Military, Trump thwart deep state blackout.”",false,6
Photos show “Elon Musk and his company are in the final stages of making a Robot Wife.”,false,5
"That does not sound fun, guy.",true,1
Foreign languages are “not a high priority” nationally,false,8
"A helicopter equipped with a heat-seeking device led to the rescue of a 19-year-old who had slipped off a mountain trail into chest-deep snow, the National Park Service said.",true,5
“Man cuts off wife’s head after DNA test proved none of 6 kids are his own.”,false,10
"Wilson, of the Las Vegas Aces, became just the third W.N.B.A. player to score at least 50 in a game.",true,8
Illinois law allows immigrants living in US illegally to become cops,false,8
Sun Junli,true,8
"If I didn’t learn to listen to my own suffering and respond with kindness to it, the doctor said, I’d undo myself.",true,3
"The hitmaker has been named a creative director at Louis Vuitton, building another bridge between two worlds with decades of history.",true,3
14 US cities signed climate treaty to eliminate meat and dairy consumption,false,8
Late-night radio listeners in Hong Kong associated Mr. Cordeiro’s sonorous voice with easy-listening standards and early rock. He worked until he was 96.,true,1
"Title 28 says the US is a private, for-profit corporation",false,1
The United Kingdom’s “Parliament closed its borders to prevent Harry and Meg from flying to the UK in order to protect the king.”,false,3
"Quaker Oats, MIT, and Harvard conducted or funded research on children deemed ""mentally retarded"" that involved feeding them radioactive breakfast cereal while telling them they were in a ""science club.",true,6
"For years, Theron Truluck was living in desperate conditions in New York City, mostly on the Q train. Now he’s part of a program that prioritizes housing for people who do not have shelter.",true,12
"Yves Saint Laurent pants. A vintage mink. And plenty of advice from Stacy London, best known for hosting “What Not to Wear.”",true,4
"Buying an electric car has become much more complicated because of restrictions on which models qualify for a federal tax credit of up to $7,500.",true,4
"New York City education officials will block payments for some companies that have billed the government to provide special education, primarily for students in yeshivas.",true,2
This word has appeared in 14 articles on NYTimes.com in the past year. Can you use it in a sentence?,true,4
"U.S. President Joe Biden convinced India, Australia, and Japan to join with the U.S. to form an organization called the Quad.",false,5
“We created more new jobs in two years than any president did in their entire term.”,false,2
"The July supermoon, also called the buck moon, is the first of four supermoons expected this year.",true,7
"George Floyd's autopsy revealed that he died from a drug overdose, not of asphyxiation or heart failure while being pinned to the ground by Minneapolis police.",false,12
"COVID-19 is caused by snake venom, not a virus; snake venom is in the COVID-19 vaccines and causes miscarriage",false,5
Dianne Feinstein posted about receiving vaccines days before she died,false,9
"Infertility is treated differently than other issues and ""often excluded from insurance coverage",true,4
Illinois “received $5.1 billion at an elementary school there that used it for equity and diversity.”,false,2
"The show is a highlight of the Public Theater’s new season, which will also include plays by Suzan-Lori Parks, Itamar Moses, Mary Kathryn Nagle and Ife Olujobi.",true,6
“Putin destroys adrenochrome lab in Ukraine.”,false,1
The CEO of Bud Light resigned following a conservative backlash to partnering with a transgender social media influencer.,false,4
The Bruce family won the return of oceanfront land near Los Angeles seized nearly a century ago. Their decision to sell for $20 million set off a different debate about reparations.,true,2
Photos show South Korean first lady touching historical documents with bare hands,false,2
A state judge in Montana was the latest to weigh in on whether laws restricting transition care for minors infringed on fundamental rights.,true,9
In case you need some puzzle help.,true,11
"Beleaguered Gazans, having fled the territory’s north, emerged from a night of bombardment wondering where to go next for safety.",true,12
"Letitia James, the state attorney general, has declined to represent Gov. Kathy Hochul in a court proceeding over how to care for thousands of asylum seekers.",true,8
"The chip designer will begin trading on Thursday, in the biggest listing of the year. Investors hope it will rejuvenate demand for new stock offerings.",true,9
"Jake Roxander’s soaring Puck in “The Dream” was the highlight of American Ballet Theater’s final two programs this fall, the first season programmed by Susan Jaffe.",true,10
"“Wisconsin has historically…and I think largely continues to be, a blue state.”",false,5
Audio shows former President Donald Trump warned “300 million Americans” will die from a catastrophe “in a matter of weeks.”,false,11
A.I. companies deliver yet another batch of impressive updates.,true,9
"The vehicle overturned at a curve on its way to a weekly town market southeast of Marrakesh, officials said.",true,8
"During the spring 2020 election in Milwaukee, a reduction to only five polling locations “came days before the election and was done without proper notice to voters.”",true,6
Photo of a Thai volleyball player flashing a three-finger salute,false,6
Mayor Eric Adams and the City Council have been engaged in a weekslong dispute over how to expand a city housing voucher program.,true,7
Video shows Hurricane Idalia making landfall in Florida,false,8
Video shows Sen. Ron Johnson talking about 'jailtime' for Hunter Biden,false,1
New laws require a father to submit a DNA test to get birth certificate,false,8
New York Attorney General announces Trump’s charges were dropped,false,4
"Joe Biden ""put 20 million people on Medicaid who aren’t even eligible, then stopped states from taking them off.",false,9
Kobe Bryant was killed “as a setup to stop him from testifying.”,false,4
Can the White House ensure that disadvantaged communities benefit from billions in renewable energy funding?,true,1
Lionel Messi speaking in fluent English,false,9
"Abdullah el-Faisal, a Jamaican cleric, was the first person to face a jury under state terrorism laws passed after Sept. 11. He was not in the city when he committed his crimes.",true,3
A TikTok ban has passed,false,3
"Robert F. Kennedy Jr. will continue his run for president as an independent, a move that could alter the dynamics of the 2024 election.",true,10
"The United Nations replaces all 193 country flags with LGBT flags"" for Pride Month.",false,6
Footage shows protesters setting the Israeli embassy in Bahrain ablaze,false,10
A video shows Disney is opening pediatric transgender clinics.,false,7
"The social networking giant, which has long had a contentious relationship with political ads, is reckoning with a wave of generative A.I. tools.",true,11
"The Central African country is wracked by war, poverty and environmental plunder — and it may be the future of the Catholic Church.",true,1
Protests over proposed judicial changes in Israel.,true,2
"Senate Republicans, even those who have broken with the former president, say their campaign chief’s decision to back him could boost their push for the majority.",true,4
Officials said there had been no reports of shark bites at Rockaway Beach “in recent memory” before Monday’s incident. The woman was in serious but stable condition.,true,8
Feeling stuck on today’s puzzle? We can help.,true,8
Chinese officials say Xi Jinping’s upcoming trip to Moscow is a peace mission. But U.S. and European officials say he aims to bolster Vladimir V. Putin.,true,3
Former U.S. President Barack Obama — a Democrat — once said Democrats have rigged elections.,false,8
“BREAKING Trump preps Marines to stop presidential coup.”,false,2
Footage shows chemicals in Ohio River,false,2
"The show about nothing ended in May 1998. But in an era when priorities are being re-evaluated, the sitcom has taken on new relevance.",true,5
"In New York, fentanyl test strips are becoming more common as a way to fight an overdose crisis, and more states are pushing to legalize them. But not all users are trying to avoid the powerful drug.",true,3
"Until 1956, French children attending school were served wine on their lunch breaks.",true,11
"CNN’s chairman, Chris Licht, said in a Monday night memo that the anchor “has agreed to participate in formal training” after making on-air comments widely regarded as sexist.",true,2
"The popular comedian will take over the show, which is based on “@midnight,” at a time when the job is being held only by men.",true,11
The negotiations at the White House came a day after the Treasury Department said the government could run out of money to pay its bills by June 1.,true,5
"“The numbers are not going down. CBP’s One app shell game, not releasing the OFO numbers, moving the numbers from crossing over to the ports of entry and then getting automatic parole to those individuals.”",false,7
"Lorenzo Vinti and Gregory DelliCarpini Jr. were married for only two years before they were hit with life’s difficulties, including Mr. Vinti’s cancer diagnosis and the death of his father.",true,6
Image shows 2024 election map built from Reuters polling numbers,false,9
"Ben & Jerry's developed its signature chunky style because the company's Co-founder Ben Cohen has limited smell and taste, and big ingredients help him experience different ice cream flavors.",true,8
The Titan submersible tragedy spotlights the issues around rescue operations and government oversight as an increasing number of wealthy thrill seekers undertake risky adventures and expeditions.,true,6
Orthodox Christians celebrate Christmas in January.,true,1
"Gov. Kathy Hochul warned New Yorkers to continue exercising caution on commutes home and through the evening, with the rain expected to shift eastward to Long Island.",true,9
"Angela Bassett, “Black Panther: Wakanda Forever”",true,1
"Gen. Omar Tchiani spoke on state television as the head of a transitional leadership in the West African country, two days after his troops detained the elected president.",true,7
"An old episode of ""The Simpsons"" featured a plot line about a run on a bank called the Silicon Valley Bank.",false,3
"Vaccine companies get immunity “no matter how negligent they are … no matter how reckless the behavior, no matter how shoddy their manufacturing and testing process is.”",false,6
This word has appeared in 175 articles on NYTimes.com in the past year. Can you use it in a sentence?,true,5
"The analysis marks the first time historical DNA has been used to trace the descendants and distant cousins of enslaved people, researchers said.",true,8
"The assault, across the river from Romania, heightened the risk of a more direct confrontation with a NATO member and came on the same day that drones struck buildings in Moscow.",true,7
"The abortion pill caused 28 maternal deaths and over 4,200 adverse events",false,5
There aren't any humans on the International Space Station,false,2
New Minnesota bill would protect pedophiles as a sexual orientation,false,4
"The church on West 14th Street, the first in Manhattan created for a Spanish-speaking congregation a century ago, has been deconsecrated. Its future is uncertain.",true,6
Sen. Marco Rubio signed a 2021 letter that “supports waivers that would reduce visual track inspections.”,false,2
"“We are about 1 degree Celsius above the coldest it’s been in the last 10,000 years” and “that’s why we shouldn’t be panicking.”",false,5
"Plus: Café de Flore-themed tableware, a stylish German pub and more recommendations from T Magazine.",true,3
"Discussing gender-affirming surgical care for minors, said that Sweden “shut it down.”",false,12
Mifepristone is dangerous,false,1
"Unions that represent about 32,000 full-time workers said the vote was overwhelmingly against the proposal, which would have raised pay by at least $1 an hour per year.",true,2
“Hiroshima and Nagasaki were never nuked.”,false,8
"The March 2021 fire, which began with a pre-Passover cleansing of the home’s kitchen and ovens, killed a resident and a firefighter.",true,9
Video shows “CBS Mornings” host Gayle King interviewing Elon Musk about a new project ensuring Canadians “won’t have to work anymore.”,false,6
“Moderna Admits mRNA Jabs Cause Turbo-Cancer”,false,11
“Andrew Tate officially gets sentenced to 15 years in prison! (Found guilty).”,false,1
"The former editor of French Vogue and renowned stylist discusses fashion week debuts, sex on the runway and why she finally got her first tattoos.",true,9
“I’m incredibly proud of that tax cuts and tax reform bill … the largest tax cut in American history.”,false,9
The Supreme Court ruled that vaccinated people worldwide are no longer humans,false,8
Video shows “everyone will be wiped out in 21 days.”,false,9
"Footage shows ""Trudeau Must Go"" protests outside CTV Ottawa",false,2
Missing Titanic-bound submarine was found empty,false,6
"Tom Hanks shouting ""sexy baby"" is connected to Jeffery Epstein and pedophilia.",false,1
The magazine’s Ethicist columnist on disclosing personal information when dating.,true,1
"If 2023 was the year of A.I. awakening, 2024 could be the year of A.I. reckoning.",true,12
Former President Donald Trump said “any indictment of me is an indictment of you.”,false,3
The soaring hopes at South Sudan’s creation in 2011 have been cruelly dashed. Pope Francis arrived in the country on Friday and immediately offered blunt criticism of its leaders.,true,2
One day on Venus is longer than a year on Venus.,true,11
SHOCKING: New Study proves Pfizer mRNA induced turbo cancer.,false,8
"A federal judge ordered the state to move the barrier, placed to discourage illegal crossings from Mexico, to the banks of the river.",true,9
DoD evacuated US embassy in Beirut and told Americans to leave Lebanon,false,10
Video shows Lebanese people scaling border wall to Israel in October 2023,false,10
Video shows protest in Wuhan over health insurance reforms,false,2
"On TikTok, the term is being used to describe romantic partners’ weird habits that are less than a deal breaker, but not exactly a plus, either.",true,6
"Alex Edelman thrives on doubt in “Just for Us” on Broadway. It’s the result of years of revision and notes from Seinfeld, Birbiglia and the late Adam Brace.",true,6
“Free dental implants” are available “through Dental Grants.”,false,7
WEF founder's daughter said permanent climate lockdowns are coming,false,7
In case you need some puzzle help.,true,10
"Sam Bankman-Fried found ways to control the prices of digital coins to benefit his companies, FTX and Alameda, according to cryptocurrency investors.",true,1
"The show, which opened in the spring of 2022, has had a remarkable box office turnaround after Michele replaced its original star.",true,8
"Representative Mark Rozzi, long a moderate Democrat, pledged not to caucus with either party as speaker of the closely divided state House of Representatives. Many questions remain.",true,1
“the mRNA jab didn’t actually save any lives”,false,5
Ethiopian army crushing militia in Amhara,false,5
Maui wildfires were caused by directed energy weapon,false,8
"Overzealous instructors, unchecked drug use, and inadequate leadership and medical oversight turned a tough selection course into a dangerous ordeal, investigators found.",true,5
Jamila Norman — a.k.a. Farmer J from the Magnolia Network series “Homegrown” — has a simple home-décor philosophy: “I don’t like buying new stuff.”,true,4
"CNN reported Sept. 7, 2023, that President Joe Biden’s family admitted “he died and was replaced by an actor in 2019.”",false,9
"Video shows Cruz unveiling Disney corruption, demanding Biden resign",false,3
In case you need some puzzle help.,true,10
“Lancet Study on Covid Vaccine Autopsies Finds 74% Were Caused by Vaccine”,false,7
"“In the last 11 months, Customs and Border Patrol has averaged 200,000 apprehensions a month, and you know how many beds we have to detain people at the border? 38,000.",true,10
"As migrants sleep on sidewalks outside a Midtown hotel, the city is struggling to avoid a homelessness crisis that resembles those in Los Angeles or San Francisco.",true,8
"Quotation of the Day for Sunday, August 13, 2023.",true,8
"You passed an emergency declaration before the state of California did,"" Newsom said. ""You closed down your beaches, your bars, your restaurants. It is a fact.",false,11
"There has been a lack of ""mainstream media"" coverage of the train derailment near East Palestine, Ohio.",false,2
"IBM, a major advertiser on X, has pulled its spending from the social media platform, whose employees are grappling with what to tell its other advertisers, according to internal messages.",true,11
No new COVID-19 variants since Russia attacked US biolabs in Ukraine,false,6
"The rate of inflation in countries using the euro slipped to 6.9 percent in the year through March, from 8.5 percent the previous month, but underlying price gains edged higher.",true,3
"Secretary of State Antony J. Blinken walked a careful line during a visit to Ethiopia as the Biden administration reassesses relations with the prime minister, Abiy Ahmed.",true,3
The UN wants to decriminalize sex between minors and adults.,false,4
"“1 million mRNA covid shots or teens will prevent 0-1 deaths and CAUSE 100,000 - 200,000 severe side effects”",false,9
"The mayor wants to improve the neighborhood for residents, but sex workers oppose measures recently put in place. Now the city is looking to set up legal prostitution elsewhere.",true,7
"Ingrid Lewis-Martin may be the second most powerful person in New York City government. But her views, leadership style and ethics have raised questions.",true,6
A new study estimates that on average 10 percent of public companies commit securities fraud each year.,true,1
Douglass Mackey was convicted “because he made a meme in the 2016 election.”,false,8
Former Attorney General Bill Barr “says Donald Trump is a spy.”,false,6
"Vaccines cause SIDS, which should be called VIDS",false,12
Turkey earthquakes were a man-made attack on Kurdish people,false,2
CMT reinstated Aldean music video and fired director who removed it,false,7
"Kfar Azza, less than two miles from Gaza, was one of the villages overrun by Palestinian gunmen on Saturday.",true,10
"In earlier cases, the justices struck down provisions of the trademark law that discriminated based on the speaker’s viewpoint.",true,6
"Aaron Kim, 16, writes about what happened when he put advice from a Well article about staycations to the test.",true,8
"After initially saying he would leave the job in September, NATO’s secretary general said he would stay on another year.",true,7
"Plus: a new riverside hotel in Portugal, hand-knotted rugs and more recommendations from T Magazine.",true,7
The prime minister said he planned to reinstate an ally barred from the government. He declined to say if he would respect a Supreme Court decision on the overhaul plan that has divided the country.,true,7
“Elon Musk bans Greta Thunberg from Twitter.”,false,3
"Moderna CEO admits company produced 100,000 vaccine doses before pandemic",false,2
Olivier Bron is arriving from a Thai department store chain as Macy’s continues its leadership shuffle.,true,9
The growing number of firearms kept in vehicles has become a new point of contention in the debates over regulating gun safety.,true,3
"Kan, a multimedia network of news, prestige TV and niche language radio, is prepared to fight for its life.",true,4
Messages and online posts from the Ph.D. student now charged with four murders show that he was once detached and suicidal before he became fascinated with criminals’ minds.,true,1
Saudi Arabia ended talks to normalize diplomacy with Israel after attack,false,10
Video shows UFO shot down in Poland,false,2
"In Iowa, Ron DeSantis warned supporters of a “malignant ideology” taking hold across the country, described children facing “indoctrination” and vowed to fight for conservative causes.",true,5
"Nearly half of U.S. adults over 30 show signs of gum disease, which can cause tooth loss. Here’s how to recognize and treat it.",true,7
"Dr. Tedros Adhanom Ghebreyesus, the director-general of the World Health Organization, ""says he isn't vaccinated.",false,9
The classic Disney characters Mickey Mouse and Minnie Mouse are breaking up and/or getting a divorce.,false,10
"Comcast, the company’s owner, said he was leaving after an investigation into “an inappropriate relationship with a woman in the company.”",true,4
French police beat firefighters in 2023 pension reform strikes,false,3
“Walmart must pay $500 to U.S. families who made purchases in 2022.”,false,9
"The population of Hroza, near Kharkiv, had dwindled to 300 before Thursday’s strike, which hit people gathered for a memorial service.",true,10
Protesters mistakenly brought Italian flags to protest backing Palestinians,false,11
“Michigan State University suspect is 22-year-old ‘Raymone Jordan.’”,false,2
Video shows Hawaiians being evicted after Maui wildfires.,false,9
"More than many other banks, SVB catered to how risky tech start-ups and their backers do not adhere to normal business practices.",true,3
"If confirmed by the Senate, the Air Force chief of staff would become the senior military adviser to the president.",true,5
Building photos are evidence Ukraine war is fake,false,2
Gold fringe on an American flag means “the Constitution is suspended.”,false,6
False claim global polar bear population is increasing,false,1
Ferdinand Marcos Jr is first president to reward athletes cash incentives,false,8
"George Soros is banned in Russia, Pakistan, Turkey, Hungary, Poland and the Philippines.",false,4
183 bodies washed up on Lanai,false,8
"In court papers, Judge Goodman made clear his involvement would be limited, saying it was “highly unlikely” he’d be asked to remain part of the case.",true,6
"Though “Minx” and “Stiffed” are set 50 years ago, the debates they present — about desire and gender and equality and autonomy — feel startlingly current.",true,7
Republicans’ “plan would cut Social Security benefits. … Average benefit cut would be 13%.”,false,11
“MRNA vaccines are being injected into our food supply.”,false,1
"Backyard chicken flocks have stopped laying eggs, and the feed is responsible.",false,1
