text,mergedTextualRating,month
"COVID-19 vaccines are the first that allow the virus to spread ""even after vaccination.",false,2
Poland is sending jets to a US air base in Germany to send to Ukraine,false,3
"The Diomedes islands located between Russia and Alaska are less than 4 kilometers (2.5 miles) apart, with a 21-hour time difference.",true,3
"Answering reader queries about the state of the music video, Morgan Wallen, SZA and Ethel Cain and more.",true,12
Queen Elizabeth II has died.,false,2
"Joe Biden ""has been secretly flying illegal immigrants into communities across the country in the middle of the night.",false,2
"They are more common than people may think. We talked to experts about the risks, symptoms and treatments",true,12
"The spouses of world leaders will be talking about the postwar reconstruction of Ukraine this weekend during the second Summit of First Ladies and Gentlemen, hosted by Olena Zelenska, the nation’s first lady.",true,7
"House Republicans' ""Commitment to America"" plan would ""Tax employer sponsored health care plans.",false,10
Entertainer Ed McMahon was a spokesperson for Publishers Clearing House.,false,5
"As leaders from across the political spectrum rushed to condemn the attack, Paul Pelosi underwent surgery to repair a skull fracture.",true,10
Images show Japan's dressing room after World Cup match with Costa Rica,false,11
"The U.S. organizes military aid for Ukraine, as Russia warns a proxy war could lead to nuclear war.",true,4
"A movie began with a genuine disclaimer that warned viewers of an ""unlikable female protagonist.",true,11
The Justice Department will have its first opportunity in a courtroom to show how the violent chaos that erupted at the Capitol last year disrupted the peaceful transfer of power.,true,2
"The boy was one of two who were shot on the street Tuesday afternoon by a gunman who was apparently targeting them, officials said.",true,7
"If so, we want to hear from you.",true,10
"Two law enforcement officials said investigators were looking into whether the man had ties to extremist groups, including one that participated in the Jan. 6 attack.",true,8
"“If you use the US Postal Service certified mail or registered mail, they can do anything they want with those ballots."" They “can burn your mail and they won't get in any trouble.”",false,10
“Abortion is never medically necessary”,false,6
"Says Gov. Tony Evers would, “allow the government to use red flag laws to confiscate your firearms without due process.”",false,9
"President Recep Tayyip Erdogan says Turkey will build homes, schools, hospitals and more in northern Syria, but experts question whether refugees will return willingly.",true,5
"In 2022, Wendy’s unveiled an “emo” version of its logo, featuring a red-headed girl with flattened side-bangs and a shaggy haircut.",true,7
A video shows the Russian warship Moskva exploding.,false,4
"Without any noted dissents, the court issued a one-sentence statement that amounted to a rebuke to the former president.",true,10
"Following the mass shooting this year in Buffalo, Gov. Kathy Hochul and Attorney General Letitia James are urging legislators to punish those who make and distribute videos of extreme violence.",true,10
"Global hunger and the chronic inability to access food skyrocketed in 2021, with 2.3 billion people facing moderate or severe food insecurity around the world, the United Nations said in a report released Wednesday.",true,7
"The president’s symptoms are “almost completely resolved,” his physician said, but he will continue to wear a mask and test more frequently than usual in coming days.",true,7
"In a video, Albert Bourla, Pfizer’s CEO, said his goal is to reduce the world’s population “by 50%” by 2023.",false,5
This term has appeared in 69 articles on NYTimes.com in the past year. Can you use it in a sentence?,true,3
Video shows Trump’s lawyer revealing evidence that proves Biden’s election was fraudulent,false,10
Lawyers have told a federal judge that they will file several motions scrutinizing the timing of his announcement that he intended to dismiss the case for lack of evidence.,true,2
"Frank Oz was the voice actor and performer behind the popular film/television characters of Yoda, Grover, Miss Piggy, Fozzie Bear, Cookie Monster, and Bert.",true,5
"The Federal Reserve’s preferred inflation measure showed that price gains remained fast in September, and a gauge of wages it watches closely is climbing quickly.",true,10
"In 2002, “Blue Crush” depicted women competing at a major competition at Hawaii’s Pipeline. That’s only now become a reality thanks to grass-roots efforts and hard-charging surfers.",true,12
“Trump is addressing to the nation today.”,false,6
A rare negotiating session did not appear to please either side. Time is running out to avoid delaying spring training.,true,1
The church reached a settlement with the New York attorney general after a lawsuit accusing officials of a yearslong cover-up of sexual abuse.,true,10
"Cities and towns across the country are shutting down, hoping to sidestep the pitfalls and stumbles that Shanghai has faced battling the Omicron variant.",true,4
Here’s what you need to know at the end of the day.,true,4
titanium dioxide in tampons are responsible for reproductive cancers,false,8
Cancer occurs when “your body is full of acidity”; alkalizing your body prevents cancer,false,7
A video that surfaced in spring 2022 showed cocaine on the desk of Ukrainian President Volodymyr Zelenskyy during a video call with Elon Musk.,false,5
The country recently began to recover from a surge that shut down Shanghai for two months.,true,7
Video shows government jets escorting a UFO,false,8
"“50% of the guns sold in Texas, because of the loopholes, do not pass through a background check.”",false,5
Image shows Elon Musk tweeted that he’s buying Snapchat,false,11
"A copy-and-paste Facebook post about the West Virginia shooting of Dennis Butler, a man who began firing on a crowd at a party with an AR-15-style rifle, is accurate.",true,6
Fanta Lemon is being discontinued in Europe from 28 May 2022.,false,5
Russian forces widened their attacks.,true,3
Dr. Anthony Fauci has not spoken or appeared publicly for several weeks.,false,3
"A photo shows ""NATO resupplying Ukrainian farmers anti-tank supplies.",false,3
The state’s voters overwhelmingly rejected an anti-abortion constitutional amendment earlier this month.,true,8
"Plus: a new bronze watch from Panerai, snails in Asian cuisine and more from T’s cultural compendium.",true,3
Suggested that U.S. climate efforts were pointless because “China’s bad air” would simply move over into American “air space.”,false,7
Image shows The Atlantic describing MI Muslim parents as the new far right,false,10
"The decision ends a review the department initiated in October, months after its inspector general issued a scathing report that sharply criticized the F.B.I.’s handling of the case.",true,5
Nathan Chen won his sixth consecutive U.S. national figure skating title and is expected to contend for a gold medal at the Beijing Games.,true,1
The Dutch port of Rotterdam and its staff are at the front line of enforcing the European Union’s restrictions on trade with Russia. It’s no easy task.,true,7
Students faking injury in JNU clash on Ramnavmi,false,4
Biden’s executive order declares that Americans must surrender human rights,false,9
"A real photo of Elon Musk at the final game of the 2022 FIFA World Cup shows him looking old, with a thinner hairline, rounder face, and sagging neck and cheeks.",false,12
Martha Karua portrait unveiled in US,false,5
Photo from “data leak at Elon Musk AND NASA … are said to be from one of Elon Musk’s Space-X satellites.”,false,5
Texas voting machine adding voters as polls close was election fraud,false,11
"The U.N. called on countries in South Asia to rescue those on the vessel, who have been without food for weeks after leaving Bangladesh.",true,12
"The bank reported a 25 percent decline in profit in the third quarter, versus last year, in part because of “very challenging markets.”",true,10
Video shows January 2022 earthquake in Indonesia's Banten province,false,1
"The Bronx Museum of the Arts celebrates a major anniversary with plans for expansion that will include a restaurant, a boutique and enhanced public spaces.",true,4
Video shows Corey Lewandowski shouting 'how dare you' at Rep. Jerry Nadler,false,10
"“My Treasury Department is planning to pay down the national debt this quarter, which never happened under my predecessor.”",false,5
"More people showed up to vote for Treasurer than Governor"" in Arizona",false,11
Video shows meeting between Vladimir Putin and South Korean president,false,3
U.S. set to ratify treaty that will establish an international gun registry,false,10
"The German automaker, which has made cars in the state for decades, has invested $1 billion in a factory to supply the power for electric vehicles.",true,3
More people with severe mental illness may soon arrive in New York City’s emergency rooms. What happens to them next?,true,12
Russian channel says WHO chief plotting against Ethiopia,false,4
"The Uvalde school shooting was a staged ""false flag"" event",false,6
Apple announced the development of a smart wedding ring called iRing in February 2022.,false,2
"Screenshots show that conservative political commentator Ben Shapiro received more than $20,000 in Paycheck Protection Program loan forgiveness.",false,8
Illinois high school to implement 'race-based grading system,false,5
There was no deadly Challenger space shuttle explosion,false,11
Photographs from the 1920s show 3-year-old Bobby Quigley smoking a cigar after public welfare officials decided they had no problem with the practice.,true,12
"The Jefferson Parish officers each face a count of manslaughter in the shooting of an unarmed man in a parked car, the latest in a long line of seemingly avoidable killings by the police in recent years.",true,2
"The Family Foundation School, closed in 2014, has long faced accusations of using improper methods. Decades later, lawsuits submitted under the Child Victims’ Act have exposed rampant claims of physical, emotional and sexual abuse.",true,1
"People who are fully vaccinated against COVID-19 are prohibited from receiving any type of anesthesia, supposedly because it's a ""great hazard"" and could cause a vaccinated patient to ""die immediately.",false,1
Barbie’s full name is Barbara Millicent Roberts.,true,8
The doctor insisted he was — but he felt it couldn’t be true. One of them was right.,true,2
"A viral photo emblazoned with fashion house Balenciaga's logo shows a ""human skin jacket"" made and sold by the company.",false,12
Video shows that Sûreté du Québec officers “removed their identifying names and badge numbers from their uniforms in Ottawa.”,false,2
"Bob Chapek’s remarks followed criticism that the company, a major employer in the state because of Disney World, had not spoken out against the legislation.",true,3
Paul Whelan received a punitive discharge from the Marines.,true,12
“Cities in notoriously ‘tough on crime’ states like Texas and Florida saw a more significant increase in violent crime than cities in NYS.”,false,3
"A Pfizer trial reports 42,000 adverse events and 1,200 fatalities",false,5
"Two of the renowned artifacts were given back to Nigeria on Friday, and Germany intends to give the African country ownership of some 1,100 more.",true,7
Guy Wesley Reffitt was convicted in March on five counts in a case viewed as a test for the Justice Department.,true,8
The CDC “lowered the bar” for developmental milestones instead of acknowledging the effects of COVID-19 restrictions in children,false,2
"In 1982, then-U.S. Sen. Joe Biden voted in favor of effectively overturning Roe v Wade.",true,7
"The $188 million resale of a duplex is the second-highest price paid for a home in New York City, and leads a busy month for residential sales.",true,1
A photograph authentically shows a woman in a shirt bearing a swastika giving a Nazi salute in front of a Jesus-esque portrait of former U.S. President Donald Trump at a political rally.,false,4
Women had been banned from the Boston Marathon for 76 years before a change 50 years ago.,true,4
Says Joe Biden risks war with Russia because Vladimir Putin doesn’t “believe in transgender rights.,false,2
A BBC radio station resumed playing dance music after announcing Queen Elizabeth II had died.,false,9
"“Our economy created over 6.5 million new jobs just last year, more jobs in one year than ever before in the history of the United States of America.”",false,3
“Harvard is sitting on top of a $54 billion hedge fund they call an ‘endowment’ that they pay zero taxes on. Yale has $31 Billion. Stanford $29 Billion. Princeton $26 Billion.”,false,8
Some people love technology that the rest of us see as obsolete junk.,true,3
Video shows congresswomen swearing and fighting,false,10
A viral image depicts a cat’s tongue when imaged under a scanning electron micrograph.,true,4
"Fires have been reported in at least 12 Nebraska counties since Friday, the authorities said.",true,4
Boris Johnson’s entire Cabinet of 15 members were arrested before resigning,false,7
"Born in San Francisco, she’ll compete in the Olympics for China, her mother’s native country. Can an 18-year-old freeskier be all things to all people in a fractured world?",true,2
"People born in American Samoa, which has been held by the United States for more than 120 years, are not automatically citizens of the United States.",true,11
Ukrainian President Volodymyr Zelenskyy wore a Nazi symbol in public appearances in 2022.,false,3
Three states and the District of Columbia allege that the tech giant misled consumers by continuing to track those who had changed their privacy settings to prevent data collection.,true,1
"Dick Zigun, who spent decades restoring the Brooklyn enclave to its carnivalesque glory, is forced out of the organization he helped create.",true,1
"There were “400,000 illegal votes” cast in the 2020 presidential election",false,4
"The president has said that he wants the advice and consent of the Senate as he deliberates, despite the reality that his nominee may draw few votes from the other side of the aisle.",true,2
From a single wave off the coast of Africa to a $52 billion sea wall a decade later.,true,10
The FBI “spent more time investigating” the Jan. 6 Capitol attack than 9/11.,false,8
A photograph shows an elephant jumping out of a suspension rail car as it crossed a river.,false,1
"“As Nevada’s attorney general, Adam Laxalt refused to sue an opioid company that dumped 400 million pills onto our streets. Maybe that’s because Laxalt took tens of thousands of dollars from opioid manufacturers to fund his campaign.",false,8
"It started around David Law’s parents’ dining room table. A decade later, “The Tennis Podcast” is the conscience of the game and how the sport communicates with itself.",true,6
The U.S. government built Oak Ridge in 1942 to develop the world’s first atomic weapon.,true,6
Safety surveillance data in the Pfizer’s document shows harmful effects of the Pfizer-BioNTech COVID-19 vaccine,false,3
"A painting with a winding history of theft, confiscation and diplomatic dispute is on public view again after decades. Its owner says Rembrandt made the work himself, but some experts aren’t convinced.",true,12
The “nightmare variant” is not as bad as it sounds.,true,11
"Once every thousand years “your age + your year of birth, every person = 2022.”",false,9
"A real photograph shows Louis Armstrong playing his trumpet for his wife, Lucille Wilson, in front of the Great Sphinx and the pyramids of Giza.",true,6
A photo shows a Ukrainian farmer towing a captured Russian jet,false,3
Elizabeth Warren’s analysis of fraud and scam complaints on the payment network found that banks at times violate a federal consumer protection law.,true,10
Liberal politicians block access to medicine based on skin color.,false,11
Joe Biden edited a Fourth of July picture and reposted it for New Year’s Day,false,1
Video shows tear gas used during Imran Khan's May 2022 protests,false,5
"Big storms are part of the ecosystem, but they’re growing more destructive because of climate change.",true,9
"There is a lot more universe out there to see than there was before the telescope launched, and there is so much more to explain.",true,7
Tiger Woods endorsed his own line of CBD gummies.,false,4
"Before she orchestrated the largest intelligence leak in U.S. history, Ms. Manning was known to D.J. on occasion. On Friday night, she shook off the cobwebs in Bushwick.",true,8
"In a 6 to 3 vote, the court blocked the administration’s mandate for large employers.",true,1
"Most hospitals have designated problem solvers on staff, but many people don’t know how to find them.",true,3
Video shows anti-war protest in Russia after Ukraine conflict in 2022,false,3
"CAMDEN, N.J. — No one thought Frank Talarico Jr. was going to live. Not his doctors, his nurses or his wife, a physician assistant who works part time at the Camden, N.J., hospital where he spent 49 days fighting to survive Covid-19.",true,4
"“Birds of Maine,” about a colony of birds fleeing disaster, showcases Michael DeForge’s trademark blend of the enigmatic and the ridiculous.",true,9
Planned Parenthood encouraged 'white privilege' donations,false,12
"In a Congolese national park, great apes of different species interact socially, with individuals clearly recognizing one another.",true,10
“NEW: Biden Admin. instructs Americans to social distance and wear masks in the event of a Nuclear Fallout.”,false,3
"In a 34-year run at New York Theater Workshop, James C. Nicola held that directors and writers are equal partners — and helped send “Rent” and “Hadestown” to Broadway.",true,7
Barack Obama’s message ahead of 2022 election in Kenya,false,1
"A flag given to U.S. House Speaker Pelosi and Vice President Harris by Ukrainian President Volodymyr Zelenskyy during a joint session of Congress in December 2022 contained Nazi ""SS"" runes.",false,12
"A new documentary examines the work and lives of the French volcanologists Katia and Maurice Krafft, helped mightily by their own magnificent footage.",true,7
Says Democratic Senate candidate Mandela Barnes “supports abolishing ICE.”,false,8
TikTok video creator Elyse Myers' official Facebook page is located at facebook.com/Elyse-Myers-107463691756865.,false,3
"As their name implies, centipedes have 100 legs.",false,6
“Gavin Newsom Gets Death Penalty.”,false,1
A video shows what shopping at Walmart will look like in the metaverse,false,1
"Saifullah Paracha, 75, was accused of being a Qaeda sympathizer and was held for two decades. But he was never charged with a crime.",true,10
A French rugby player's death is connected to the COVID-19 vaccine,false,1
Photo shows Keystone Pipeline compared to a lithium mine,false,6
"Nadia Popovici wrote a message on her phone, with “mole,” “cancer” and “doctor” in bright-red type to get the attention of Brian Hamilton, an assistant equipment manager for the Vancouver Canucks.",true,1
"A vote this week at a warehouse near Albany, N.Y., will help show whether the upstart union can win outside its home base on Staten Island.",true,10
“‘Gold Standard’ Scientific Trial Deals Massive Blow to N95 and Surgical Masks as Way to ‘Stop Covid’”,false,11
Photos show “an IRS agent training class.”,false,8
“Ted Cruz erupts as FBI director tries to defend Biden over Mar-a-Lago raid” in video.,false,8
"In January 2022, a Boston hospital denied a patient a heart transplant because he refused COVID-19 vaccination.",true,1
The court did not say which of the three defendants was infected with the coronavirus. The judge paused the proceedings at least until Monday.,true,2
The COVID-19 vaccine caused Katy Perry’s eye to close during a recent show.,false,10
"As 100 million Americans swelter under heat warnings, the president is considering whether to invoke special powers to address climate change.",true,7
An extravagant 1787 party attended by George Washington ran up a hefty tab,true,1
"Adam Laxalt fought an investigation into the oil industry, then they funded his campaign.",false,6
“We are a nation that no longer has a free and fair press. Fake news is about all you get. We are a nation where free speech is no longer allowed.”,false,8
The federal authorities filed criminal and civil charges against nine people in a series of unrelated cases that netted more than $7 million in gains from trading ahead of corporate mergers.,true,7
Andrew Linzer’s Saturday debut will have you searching for connections.,true,8
"“We have 76% of Americans living paycheck to paycheck, meaning they are one paycheck away from poverty.”",false,4
The Berry Global company posted a sign that stated a policy forbidding employees from taking their breaks and lunches in their cars.,false,10
These photos show victims of mosque attack in India,false,3
A woman stole a baby from a North Carolina hospital,false,7
"A Broadway actress, documentary filmmaker and DC comic artist are among this year’s recipients. They were selected by fellow disabled artists from a pool of about 60 nominees.",true,7
"In a setback to Scottish nationalists, the judges ruled that a second referendum on breaking away from London needed the consent of the British Parliament.",true,11
A viral photograph authentically shows an orca (killer whale) in a city street flooded by Hurricane Ian.,false,9
"Republicans are focusing on pocketbook issues, and Democrats are emphasizing abortion rights, as Labor Day marks the start of the midterm elections’ final stretch.",true,9
Canola oil is toxic,false,2
An image shows the Earth and sun in the same picture,false,1
"Security was tight for this election, a particularly high-stakes contest that some observers have called an existential battle for the soul of the nation.",true,5
Document shows Pfizer-BioNTech said vaccine should not be given to women who are pregnant or breastfeeding,false,5
The first run of the women’s singles luge event will air at 8:05 a.m. on USA Network.,true,2
"The singer Grimes, whose real name is Claire Boucher, unsuccessfully tried to sail the Mississippi River from Minneapolis to New Orleans in a homemade houseboat.",true,5
“Barack Obama’s real father is Communist Party propagandist Frank Marshall Davis.”,false,1
Rock singer Meat Loaf attempted to push Prince Andrew into a moat.,false,1
Parents in the United States can obtain baby formula from Amazon Canada by changing their location settings.,false,5
Mehmet Oz “wants to make abortion a crime in Pennsylvania.”,false,6
Williams died before finishing the new season of his documentary series “Black Market.” The producers completed it with the help of some famous friends.,true,1
Ukrainian President Volodymyr Zelensky wore a Nazi cross symbol.,false,3
"Twitter removed over 44,000 accounts linked to child sexual exploitation in India since Musk's takeover",false,12
"Researchers at Ben-Gurion University in Israel taught goldfish to steer a specially designed ""fish-operated vehicle"" to get food.",true,1
"In early 2022, Mark Cuban launched an online pharmacy called Cost Plus Drug Company.",true,2
"Edwin Booth, the brother of U.S. President Abraham Lincoln’s assassin John Wilkes Booth, saved the life of Robert Todd Lincoln, the president’s son.",true,12
Photo shows Moroccan boy Rayan Oram after being rescued from a well,false,2
A video captured from the North Pole shows the moon eclipsing the sun,false,4
Judge Elizabeth A. Scherer will impose the gunman’s sentence after the jury recommends death or life in prison.,true,7
"Éric Zemmour, a pundit whose presidential run has upended French politics, had called unaccompanied migrant children “murderers” and “rapists” on television.",true,1
"The company’s huge investment portfolio lost money, while its insurance arm felt the effects of Hurricane Ian and inflation-driven rises in property and damage claims.",true,11
US moving guards protecting its southern border to Europe,false,2
Footage of the Bidens celebrating Easter at the White House is fake.,false,4
"From zero-pressure balloon trips to astronaut boot camps, reservations for getting off the planet — or pretending to — are skyrocketing. The prices, however, are still out of this world.",true,5
“The immune system does not exist.”,false,7
"Senator Susan Collins, a centrist from Maine, said a second meeting with Judge Ketanji Brown Jackson alleviated her concerns. It is unclear if other Republicans will join her.",true,3
Scientists are split over whether the benefits some microdosers experience are a placebo effect or something more.,true,2
A group chat including crypto leaders shows Binance’s Changpeng Zhao accusing FTX’s Sam Bankman-Fried of orchestrating trades to destabilize the industry.,true,12
Automated payment and the spread of tipping to every corner of the food-service business have helped workers weather the pandemic. But some consumers feel overwhelmed.,true,4
"Johnny Depp is organizing a tour with Kyle Rittenhouse to ""spread awareness"" about the ""dangers"" of defamation.",false,6
District Vision wants to meld the inner and the outer life of athletes.,true,4
An image shows a tweet from Elon Musk that says he will shut down Twitter,false,4
"Whether hard launching a relationship, recreating a childhood memory or just doing it for the ’Gram, people are embracing a cuffing season tradition.",true,11
A Time magazine cover shows Vladimir Putin with Hitler’s mustache.,false,3
