text,mergedTextualRating,month
Josh Riley “supports help not handcuffs” for criminals and supports defunding the police.,false,10
“I’ve been in and out of Iraq and Afghanistan over 40 times.”,false,3
A U.S. military veteran named Jacob Rivas sold his medals in order to afford groceries.,false,8
More than 100 cases have been reported in recent weeks among populations not typically vulnerable to the disease.,true,5
Video shows voter fraud at a polling station in Philadelphia,false,11
"The revival, directed by Camille A. Brown, received strong reviews but struggled to attract audiences and overcome challenges posed by Covid.",true,5
“High-ranking Ukrainian officials caught splurging on luxury real estate in Switzerland.”,false,6
"Ukrainian officials are optimistic that rolling power outages will not be necessary around the New Year holidays as crews work to repair the country’s power grid, which has been battered by Russian strikes.",true,12
"COVID"" is an acronym that stands for discovered (and yet to be discovered) variants of COVID-19.",false,1
The annual citywide event is back with a Champagne dim sum brunch and a lavish vegan dinner.,true,8
Monkeypox is a side effect of the COVID-19 vaccine,false,7
"The Canadian actress Petrina Bromley has been in the cast during the show’s surprise hit run on Broadway. It resonated because “it’s about kindness,” she says.",true,10
A selection of books published this week.,true,7
"For generations, entrepreneurs and dreamers have moved to New York City to strike it big. Now they’re coming to sell a lot of cannabis.",true,6
Video shows Vatican City on fire in July 2022,false,7
"The exclusion of Russia from the contest has underlined the country’s estrangement from the west, including in popular culture.",true,5
Photo shows suicide victim after Agnipath scheme announcement,false,6
"Chicago house, hyperpop, classic ’70s disco: The pop star’s new album is a tour through some of the genre’s most well-known touchstones as well as more underground sounds.",true,7
Plans to use two new robot dogs only in precarious search and rescue missions may help avoid the controversy that met the Police Department’s robots last year.,true,3
"While Ecuadoreans power the market in greater Cuenca, the city has long attracted retirees with its low cost of living and high quality of life.",true,6
A video shows an orangutan trying to fight off a bulldozer razing an Indonesian forest.,true,1
"“This Arabella group is funded by Soros and some other liberal billionaire … but they basically said, ‘If you pick Childs you may have a primary opponent.’",false,3
“most of the individuals who had been fully vaccinated would develop full-blown vaccine-induced acquired immunodeficiency syndrome by the end of the month”,false,1
The staged voting in Russian-occupied areas of Ukraine is taking place against a backdrop of violence and repression.,true,9
"The Internal Revenue Service failed to audit former President Donald J. Trump’s tax filings for his first two years in office despite having a policy that makes the auditing of sitting presidents mandatory, a House committee revealed on Tuesday after an extraordinary vote to make public six years of his tax returns.",true,12
"In a country more accustomed to temperate weather, a brutal heat wave tested Britain’s infrastructure and forced millions to choose between a Stygian commute or a stifling home office.",true,7
"Elon Musk said, “In some parts of the world, journalists get murdered for crossing the wrong people.”",false,12
"In Joe Biden’s America, your children are more likely to have access to a crack pipe than a mask-free education.",false,2
"The bodies were found at two locations in the city of Laurel that are about three blocks apart, the Nebraska State Patrol said.",true,8
Build Back Better “would be a huge payday for Chinese manufacturing” and “would fill our streets with cars made with Chinese parts.”,false,1
"Desperate for cash as the fallout from the Ukraine war batters its economy, Egypt has been conserving natural gas at home to sell to Europe.",true,11
A study showed that the number of serious adverse vaccine events associated with COVID-19 vaccines is “too high”,false,12
"The plane went down in bad weather on Sunday while carrying passengers to Jomsom, a tourist destination popular with trekkers.",true,5
"In a lively argument over copyright law that included many references to pop culture, the justices struggled to determine when a new work transforms an older one.",true,10
Conor McGregor died in August 2022.,false,8
Video shows crowd in London shouting profane chant at Biden's motorcade,false,9
"If a 12-year-old girl became pregnant because of rape or incest, ""Tim Michels would force her to deliver the baby.",true,10
Tim Michels “supports no exceptions for rape [or] incest.”,false,10
"Pigs and figs in a blanket, cheesy za’atar pinwheels and crunchy coconut twists: These quick, easy bites from Melissa Clark will take any festivities to the next level.",true,12
"“We are seeing the pandemic situation has improved,” said Dr. V.K. Paul, the head of India’s Covid task force.",true,2
"Dan Price was applauded for paying a minimum salary of $70,000 at his Seattle company and criticizing corporate greed. The adulation helped to hide and enable his behavior.",true,8
"Democrats hope the tax will encourage companies to spend more on workers and operations, but strategists think it’s unlikely to deter corporations from repurchasing their stock.",true,8
"Researchers said they were just beginning to comb through the 13,173 documents, hoping they might shed further light on the government’s actions before and after Nov. 22, 1963.",true,12
There are no photos of “Biden in the Oval Office” from after early 2021.,false,10
"A renovated 1951 house in Houston, a two-bedroom condominium in Atlanta and a 1791 home in Halifax.",true,2
The Centers for Disease Control and Prevention has amassed the “largest collection of human data in history” through COVID-19 PCR tests.,false,2
Indonesian parliament officially postpones general elections,false,3
"“I’m an exterminator and a bedbug eliminator. I’m a consultant. I’m a psychiatrist (I’m not a psychiatrist, I’m just being facetious).”",true,4
“Republicans want to raise the voting to age 28.”,false,11
It’s unlikely that you’ll be watching kitten videos one day and believing in QAnon the next.,true,4
"The new climate, tax and health law signed by President Biden extends a credit for electric vehicle buyers. But there are new strings attached that kick in at different times.",true,8
"Disputes over compensation and firings, and potentially over layoffs, could push both sides into fresh legal battles.",true,11
"In 2021, “11,201 pounds of fentanyl were seized by Customs and Border Protection, which is enough to kill every American nearly seven times over.”",true,4
"Entries for the week of Oct. 17, 2022.",true,10
"The tennis star’s firm, Serena Ventures, will invest in founders with diverse points of view.",true,3
"Rich with cheese and filled with butternut squash and mushrooms, this breakfast casserole is worth waking up for.",true,12
"Se suponía que el acuerdo de paz de Colombia, firmado en 2016 por el gobierno y las Fuerzas Armadas Revolucionarias de Colombia, o FARC, sería el inicio de una nueva era de tranquilidad en un país que soportó más de cinco décadas de conflicto. El acuerdo consistía en que los rebeldes dejaran las armas, mientras que el gobierno inundaba las zonas de conflicto con oportunidades de trabajo, aliviando así la pobreza y la desigualdad que originaron la guerra.",true,6
"Noah joked on Thursday that Trump gets away with so much criminal activity, “it just shows us we could do crime, too.”",true,10
"U.S. Supreme Court Justice Neil Gorsuch said the flu kills ""hundreds of thousands of people every year.",false,1
"Some veterans have started businesses that draw from their experiences in Iraq and Afghanistan, and thrived.",true,5
A photo shows Magic Johnson donating blood for people with COVID-19.,false,8
"TV personalities such as Shark Tank investors, Dr. Phil and Dr. Oz endorsed CBD gummies; CBD gummies have numerous health benefits",false,3
Katie Hobbs signing Arizona’s election certification was “unconstitutional.”,false,12
"The word ""cakewalk"" comes from dances performed by Black American slaves on Southern plantations to mock their white slave owners.",true,2
Researchers from the Wuhan Institute of Virology (WIV) “assembled monkeypox strains”,false,5
"In 2022, ice cream company Klondike discontinued its ""choco taco"" product.",true,7
The Biden administration is responsible for “bare shelves” of infant formula.,false,5
"“Teachers can only deduct up to $250 for school supplies on their taxes, but billionaires can write off the entire cost of a private jet.”",true,2
Postal Service can destroy mail-in ballots with impunity,false,10
"In the United Kingdom, “Charles cedes throne to William immediately.”",false,9
A warning label on cigarette packaging changed from December to January,false,1
High-speed video recordings reveal that the cephalopod’s eight arms aren’t moving randomly when they go in for the kill.,true,9
Chileans rejected a proposed constitution that would have been the first to confront climate change. But they are not done.,true,9
NASA just hired 24 theologians to assess how the world would react to discovery of extraterrestrial life,false,1
The group lost its lead singer just as it was gaining widespread acclaim. Its members have come up with an unusual solution.,true,6
Actor Tom Holland is “confirmed to have died.”,false,7
"Elon Musk tweeted, “The Democrats paid the CEO Jack Dorsey of Twitter millions of dollars to block and delete people’s pages during the 2020 election.”",false,12
Feeling stuck on today’s puzzle? We can help.,true,3
Each week we spotlight five student activities created for a broad range of learners based on reporting in The New York Times.,true,3
"Conservative commentator Matt Walsh once tweeted, ""'Taking advantage' of a drunk girl is not rape.",false,12
Some 75% of all COVID-19 deaths involve people with at least four comorbidities.,false,1
"An airplane is visible in a scene in the movie ""Gladiator,"" which was set in ancient Rome.",false,4
"Babies and children younger than age 5 were hospitalized with coronavirus at much higher rates during the latest U.S. surge, when the highly transmissible Omicron variant was dominant, compared with earlier periods in the pandemic, according to the Centers for Disease Control and Prevention.",true,3
Video shows Florida schools were open during the hurricane,false,10
"“Every 37 seconds, someone is arrested for possession of marijuana.”",false,1
The U.S. will run out of diesel fuel in 25 days,false,11
Video shows Indian PM Modi giving a speech in January 2022 in Goa,false,1
Do smart watches work as training wheels for a smartphone? Or do they just hook children on technology at an even earlier age?,true,10
Says Republican U.S. Sen. Ron Johnson “called climate change ‘bull----’ during a record heatwave” and “raked in over $700k in fossil fuel cash.”,true,8
The notion of a return to some kind of prepandemic normal without intervention has been abandoned.,true,5
"The tally shows how ubiquitous firearms, many illegal, are in New York, with more legal ones anticipated after a recent Supreme Court ruling.",true,7
"President Pedro Castillo had banned Lima residents from leaving their homes for nearly 24 hours, raising concerns among human rights groups and critics, but demonstrations continued after he backtracked.",true,4
"In myth, the cryptocurrency is egalitarian, decentralized and all but anonymous. The reality is very different, scientists have found.",true,6
"After he became vice president in 2008, current U.S. President Joe Biden gave his uncle, Frank H. Biden, a Purple Heart for his military service in the Battle of the Bulge during World War II.",false,12
"The gains could raise pressure on policymakers, but analysts say the higher prices may be short-lived as refineries in California and Washington restart production.",true,10
Pakistanis detained after heckling Shehbaz Sharif at Saudi Arabian mosque,false,4
"Instead of fighting opioid addiction, a nonprofit founded by J.D. Vance paid his “top political adviser” and funded “political polling.”",true,7
“Biden admits $5 is being done on purpose” and “this has been his plan all along.”,false,7
The COVID-19 vaccine “destroys the subject’s natural immune system”; HIV VB variant is a “cover up”,false,2
Video shows Italian truckers protesting vaccine mandates,false,1
"An authentic advertisement from the late 19th century includes a sketch of a woman in a “toilet mask” or “face glove” intended to “beautify,” “bleach,” and “preserve the complexion.”",true,12
"The “deliberate cruelty” of Russia’s latest bombardment has made the West more determined to help Ukraine, Defense Secretary Lloyd J. Austin III said.",true,10
Your state will send you free infant formula if you call Enfamil and Similac customer service numbers.,false,5
"Paul Pelosi, 82, underwent surgery for a skull fracture after he was assaulted at the couple’s home in San Francisco, and was expected to recover, a spokesman for Ms. Pelosi said.",true,10
"The California governor is up to something as he bashes Donald Trump, Ron DeSantis and even his fellow Democrats. Just what, exactly, is a hot topic of discussion on the left.",true,6
"A ballot question in Connecticut would ""remove the requirement of a certified seal from certain ballots when submitted to the Secretary of the State.",false,10
"This month’s picks include movies about an alien best friend, zombies with a strong sense of smell and lab-created superwomen.",true,11
A photo shows Marjorie Taylor Greene wearing a Soviet shirt and giving a Nazi salute.,false,6
"Will Arbery’s work challenges us to slow down, even when dealing with the pressures of political and social discord.",true,11
Ray Epps became the unwitting face of an attempt by pro-Trump forces to promote the baseless idea that the F.B.I. was behind the attack on the Capitol.,true,7
Image shows Arizona gubernatorial candidate and Secretary of State Katie Hobbs in the room where ballots were being counted in Maricopa County.,false,11
Russia’s Army was “destroyed.”,false,12
"Shootings in Tennessee, Virginia, Arizona and South Carolina left six more dead and dozens injured.",true,6
Images show the aftermath of a bear locked in a vehicle in multiple cities,false,10
“Paying taxes is optional!!”,false,4
"Kaitlin Marie Armstrong is being sought in the killing of Anna Moriah Wilson, according to the police, who said both women were romantically involved with the same man.",true,5
"Every time a Republican has been elected president over the last few decades, House Democrats have objected to the result",true,9
"Fósforo, a new mezcal brand financed by Jim Cramer, is releasing two styles of the spirit made from tobalá.",true,4
"Facing an uncontrolled surge of virus cases, parents of young children are again forced to wrestle with child care crises as the rest of the world appears eager to move on.",true,1
Feeling stuck on today’s puzzle? We can help.,true,5
"Stores are shortening hours, fitting rooms are being closed and some employees can’t go on break. “Morale could not be lower,” one retail worker said.",true,1
Nigerian state passes Sharia law to gain votes,false,7
Says Bob Saget predicted his death.,false,2
"A ranger was photographed lifting a baby elephant out of a watering hole and was later ""thanked"" by its mother.",false,2
"Nearly 60% of all student loan debt is held by the rich and upper-middle class,"" so forgiveness would give the wealthy a ""financial windfall"" but not really help low-income people.",false,5
"A photograph shows the large, twisting Takaosan Interchange in Tokyo, Japan.",true,9
Japan’s longest-serving prime minister became perhaps the most transformational politician in the country’s post-World War II history.,true,7
"The two Spanish actors discuss working together on a satire about the film industry, how they feel about awards and how they get into character.",true,6
The magazine’s Ethicist columnist on whether to renew a relationship with an estranged sibling.,true,3
"The deaths occurred during an attempted mass crossing by 2,000 people over border fences into Melilla. Several human rights groups have called for an investigation.",true,6
This word has appeared in 65 articles on NYTimes.com in the past year. Can you use it in a sentence?,true,1
"Those buying ammunition in the United States are not subject to a background check, but anyone who buys certain nasal decongestants is added to a national database.",true,5
The committee released surveillance footage of a Capitol complex tour on Jan. 5 and video of a man it said was part of the tour marching toward the Capitol during the riot.,true,6
Olaf Scholz will try to repair Germany’s credibility in the Ukraine crisis when he meets President Biden on Monday. Next on his agenda: Kyiv and Moscow.,true,2
The Supreme Court overturned the 2020 election,false,7
The two award-winning actors had never worked together before this brooding FX thriller came along. Who knew the journey would become so existential?,true,6
Many of the no-cost online services have age or income limits. But some are available to anyone.,true,2
Just released” Pfizer documents show the Pfizer COVID-19 vaccine is “12% effective.”,false,5
"Williams will face the tournament’s No. 2 seed, Anett Kontaveit of Estonia, on Wednesday.",true,8
Army Rangers killed her parents. A Marine is raising her in America. But her Afghan family says she was taken under false pretenses.,true,11
Costco gas pump screen says 'Don’t blame us. Blame Joe Biden,false,5
"President Barack Hussein Obama kept 33 million pages of documents, much of them classified. How many of them pertained to nuclear? Word is, lots!",false,8
"A fourth, $2,000 stimulus payment is being sent out",false,1
The gunman used a rifle to kill three people and injure two others before he was shot dead. He had spent an hour inside a mall bathroom apparently preparing for the attack.,true,7
CDC data show mass vaccination with the COVID-19 vaccine has had no measurable impact on COVID-19 mortality in the U.S.,false,2
"Thousands of Afghans are trying to sneak into Iran and Pakistan each day, as incomes have dried up and life-threatening hunger has become widespread.",true,2
The case against the founder of the failed blood testing start-up Theranos came to symbolize the pitfalls of Silicon Valley’s culture of hustle and hype.,true,1
"Former U.S. President Donald Trump died on Nov. 1, 2022.",false,11
"Cold events show that Earth is cooling, not warming.",false,12
"James Bullard, who leads the Federal Reserve Bank of St. Louis, appeared at a Citigroup forum last week in Washington. Reporters were not invited.",true,10
Image shows NASA's Atlantis shuttle launching into space,false,8
It’s impossible for colloidal silver to turn you blue.,false,10
Event 201 is evidence that officials already knew about COVID-19,false,5
"“I’d never read anything like it,” says the actor and director, whose memoir “All About Me!” is newly out in paperback. “It was hysterically funny and incredibly moving at the same time. It’s like Gogol stuck a pen in his heart, and it didn’t even go through his mind on its way to the page.”",true,11
The nations least responsible for climate change are being hit the hardest. They’ll be demanding compensation at the climate summit starting Sunday in Egypt.,true,11
"“My Treasury Department is planning to pay down the national debt this quarter, which never happened under my predecessor.”",false,5
"A video shows two helicopters escorting a UFO over Durham, Connecticut, in January 2022.",false,2
Falsehoods about election fraud pushed by Odinga and Ruto activists,false,7
Eight countries pulled their ambassadors out of Turkey pre-earthquake,false,2
"The record red ink, fueled by spending to combat the coronavirus, comes as interest rates are expected to rise, which could add to America’s costs.",true,2
Buzz Aldrin’s comments during an interview with Conan O’Brien prove the moon landing was fake.,false,2
Andrey Kurkov has spent his life writing about realities so absurd they defy satire. It was perfect preparation for this moment.,true,5
"Representative Kurt Schrader, a seven-term Democrat, lost his primary to a more liberal opponent. Now the competitive seat is up for grabs, with a Republican favored to win.",true,11
Bumblebees don’t fly but levitate through acoustic levitation,false,8
Dominion lost its lawsuits against Rudy Giuliani and Sidney Powell,false,5
"COVID-19 vaccine mRNA is converted to DNA and enters the cell’s nucleus, so the vaccines can potentially change our DNA",false,3
Video shows Chinese communist assaulting native Indonesian,false,9
"Oona Doherty, a rising star in Europe, brings a Belfast-inspired piece to New York. “This is about kinetic trauma,” she says. “This is about you, as well.”",true,1
"“For the last several months, wages have gone up more than prices have gone up.”",true,12
The National Institutes of Health added ivermectin to its list of COVID-19 treatments,false,9
"A viral image shows the design for an official Ukraine stamp to commemorate the moment a Ukrainian soldier said: ""Russian Warship, Go Fuck Yourself.",true,3
The IRS donated to Katie Hobbs’ campaign,false,11
"Before the release of the sequel “Avatar: The Way of Water,” the iconoclastic filmmaker explains why he’s bringing the first film back to theaters.",true,9
Disaffected Republicans have taken wildly divergent paths to opposing Donald Trump. We will soon get new tests of whose strategy is working better.,true,7
More and more office workers are being called back to their cubicles. Many are not having it.,true,6
"En una entrevista con el Times, en 2016, el entonces congresista dijo que se “comería un indio”, lo que desencadenó una ola de críticas en su contra en la recta final de la contienda presidencial.",true,10
"Avicii, Chester Bennington, Anthony Bourdain and Chris Cornell all died by suicide while working on the film 'Silent Children",false,1
"So after 50 years of being virtually empty, I built up our oil reserves during my administration ... to 100% full. It’s called the Strategic National Reserves, and it hasn’t been full for many decades.",false,3
Disney Channel is shutting down in the U.S.,false,12
“We are allowing human organisms to become bioweapon factories”,false,3
"An opportunity to hear from, and ask questions of, the journalists who helped ignite the #MeToo movement.",true,1
A video shows Pope Francis slapping Donald Trump's hand,false,9
"On Dec. 28, 2021, three days before her death, Betty White said ""Eat healthy and get all your vaccines. I just got boosted today.",false,1
"Russia’s decision to restart the flow of natural gas through a vital pipeline on Thursday brought a moment of relief to Germany, which uses the fuel to power its most important industries and heat half its homes. But it is unlikely to be much more than that, Melissa Eddy reports for The New York Times.",true,7
What new or returning shows are you excited to watch?,true,1
“The majority of citizens in the country will have no change at all because … most of the population resides in states that have already protected abortion rights.”,false,6
"Countries that depend on the region’s rich supply of energy, wheat, nickel and other staples could feel the pain of price spikes.",true,2
U.S. officials are mapping out scenarios for how Russia might carry out a nuclear strike.,true,10
"Benjamin Millepied’s L.A. Dance Project presents a “Romeo and Juliet” with same-sex lovers. And at Paris Opera Ballet, Alan Lucien Oyen goes Bauschian.",true,9
"Raphael Warnock ""believes in no cash bail"" and ""letting people out of prison that are going to make us prisoners in our own home.",false,11
"When videos and photos emerged in April showing bodies of dozens of civilians strewn along a street in Bucha, Ukrainians and the rest of the world voiced horror and outrage. But in Russia, officials had a completely different reaction: denial.",true,12
"Marie Perez, a Democrat, and Joe Kent, a Trump-backed Republican, will face off in November after winning their “jungle primary” against Representative Jaime Herrera Beutler, who criticized Trump after Jan. 6.",true,8
"Sometimes, what might have been never stops mattering.",true,1
"In this lesson, students will learn how the pandemic has contributed to an increasing number of American children and teenagers being killed by guns, and consider what can be done.",true,1
"The nation’s second-largest public school district, which had held out even after the state dropped its mandate, will continue to strongly recommend masks in classrooms.",true,3
“Fully vaccinated Australians in hospital for COVID-19 surpass unvaccinated”,false,1
Highlights a Kathy Barnette tweet with the hashtags “#BLM #DefundThePolice” to claim she “holds extreme views on race.”,false,5
"Jerome Powell, the Fed chair, said the central bank is prepared to raise rates more quickly and higher if price pressures fail to fade.",true,5
"C. Wesley Morgan once believed that the place he built, which included a 2,000-square-foot bunker, was the safest house in Kentucky.",true,7
"Mr. Kelly, who ran as a bipartisan legislator devoted to the needs of Arizona, defeated Blake Masters, a Republican newcomer whose ideological fervor failed to win over enough independent voters.",true,11
