text,mergedTextualRating,month
Image shows demolished dome of Delhi's Jama Masjid,false,5
The tech industry has grown ever more rich off big ideas that were developed more than a decade ago. New things like quantum computing and self-driving cars could take a while.,true,1
"In 2018, ""when votes were being stolen by the corrupt Election process in Broward County ... I sent in the FBI and the U.S. Attorneys. ... I stopped his [Ron DeSantis'] Election from being stolen.",false,11
"It’s the first time underwear has been authorized for this purpose, and it provides a new choice for protection where the few options have been unpopular.",true,5
"“We have over 100,000 children, which we’ve never had before, in serious condition, and many on ventilators” due to the coronavirus.",false,1
"Syria, North Korea, Eritrea and Belarus voted against the resolution, joining Russia, which called the measure “pseudo-humanitarian.”",true,3
"Five articles from around The Times, narrated just for you.",true,2
"When Hunter Davis asked Kara Naseef out on a first date, both were overcome with emotion. The same thing happened three years later when Ms. Davis proposed.",true,7
Philippines issues order to inspect bars for illegally staying foreigners,false,11
"Vegan chocolate bars, dreamy cookbooks and more small luxuries to give this year, as well as some ideas for your Thanksgiving leftovers.",true,11
"In January 1896, Walter Arnold became the first person in British history convicted of a speeding offense when he drove above 2 mph in Tunbridge Wells, Kent.",true,2
A boy rescued from Chambal river flood in India.,false,8
"Says Barack Obama tweeted, “Has anyone checked to make sure Donald Trump doesn’t have a Russian birth certificate?”",false,4
The Justice Department told an appeals court that a federal judge was wrong to intervene in its investigation into the former president’s hoarding of sensitive records.,true,10
Some people who had taken the antiviral medication experienced a recurrence of Covid symptoms after their infection appeared to have cleared up.,true,12
The CDC has classified monkeypox as an airborne form of herpes that can lead to paralysis.,false,8
Democrats used 47M mail-in ballots to steal every U.S. midterm election,false,11
A married couple disagree on what to call their protein source.,true,3
"For nearly two years, the country projected a harsh message of rigidity and “rules are rules.” Will long-haul travelers bet on the easygoing, inviting image it is sending out now?",true,2
Ukraine announced it's the first country to implement the 'Great Reset' through a mobile app,false,3
Democrats on the U.S. House Judiciary Committee voted to allow non-citizens to vote in U.S. elections.,false,11
COVID-19 PCR tests are human cloning technology,false,11
“Minnesota was stolen from Scott Jensen.”,false,11
Footage shows robbery in Sri Lanka,false,7
Colorado banned ballot drop boxes,false,7
The U.S. search for Ayman al-Zawahri had spanned decades. His presence on a balcony at a safe house in Kabul presented an opportunity to strike.,true,8
Shares of the company slumped as investors worried about increasing competition.,true,10
The Oxford Dictionary added an entry for the word “twerk.”,true,7
The country has instituted a wide range of high-tech controls on society as part of a mostly successful effort to stop the virus. The consequences may endure.,true,1
"Then-Vice President Mike Pence ""seized power"" from President Donald Trump and undertook ""a coup"" when he called on federal agencies to stop the Jan. 6 Capitol riot.",false,7
"Moscow posted a death toll from its attack on Ukraine for the first time, and Russians who long avoided politics are now grappling with the fact that their country is fighting a deadly conflict.",true,3
Social justice joins discounted cash flows on the syllabus as essential knowledge for aspiring corporate leaders.,true,11
"COVID-19 vaccines are the first to be required, threatening ""livelihoods, work [and] school.",false,2
Tesla launched a cryptocurrency platform that “aims to help families become wealthier.”,false,12
"With the River, a bar in Manhattan’s Chinatown, Emily Bode and Green River Project have expanded their wood-stained empire.",true,6
“Believing CO2 controls the climate is pretty close to believing in magic.”,false,8
Suggested reading from critics and editors at The New York Times.,true,11
There were no flu cases last year because they were all reported as COVID-19,false,12
The FDA said Pfizer vaccines cause blood clotting,false,12
"“It’s not that there is no evidence the election was stolen, but that no court had the guts to HEAR the evidence. They dismissed the cases, NOT the evidence.”",false,10
Our critics and writers have selected noteworthy cultural events to experience virtually and in person in New York City.,true,2
"Since New York’s eviction moratorium ended in January, tenants and their landlords are returning to housing court.",true,6
“Joe Biden left Marines behind in Afghanistan. And now he left a Marine behind in Russia.”,false,12
“Hunter Biden arrested this morning.”,false,4
A video that shows a Waste Management garbage truck bursting into flames is real and was not staged.,true,9
My people have always turned our haters into humor. It still breaks my heart when antisemitism starts trending.,true,11
"Forging an alliance with President Volodymyr Zelensky of Ukraine was a natural for Boris Johnson, Britain’s prime minister. The two share a sense of the moment.",true,3
"Five articles from around The Times, narrated just for you.",true,12
"Security forces fired on a crowd at a metro station on Tuesday, setting off a panicked rush of commuters, video showed.",true,11
"AVILO-USPENKA, Russia — Inna Shalpa, a resident of the separatist-held town of Ilovaisk in eastern Ukraine, had no idea where the Russian bus she stepped into with her three children would take her on Saturday. But she was ready to accept the uncertainty, convinced that a wider war at home was imminent.",true,2
Rich Strike’s owner said he had decided not to push the horse to run only two weeks after he came out of nowhere to win at Churchill Downs.,true,5
Colorado rigged its 2022 midterm elections by sending non-citizens a mailer,false,10
Closed briefings by police investigators divulged extensive new plot details to German lawmakers — from death vows to caches of bullets.,true,12
Video shows Ukrainian air defenses in Sievierodonetsk shooting down “55 Ka 52 helicopters.”,false,7
The World Economic Forum called for the slaughter of pets to save the climate.,false,12
"When placed under ultraviolet light, scorpions fluoresce to glow a blue-green color.",true,6
Human remains were found in a room that was underneath what was the garden in Benjamin Franklin's London home.,true,12
Sunny Hostin of “The View” admitted to voter fraud.,false,11
"Two years ago we were “drilling our own oil for $27 a barrel.” Now, thanks to Joe Biden, we’re “paying $105 a barrel to Russia.”",false,3
"In ""Friends,"" Ross's mix-up between Emily and Rachel originated by accident, in a mistake by the actor David Schwimmer.",true,4
The SARS-CoV-2 virus was engineered in a laboratory and deliberately released,false,4
Martial arts and film icon Bruce Lee died from drinking too much water.,false,11
"Kathy Barnette ""pretends she's America First, but repeatedly attacked President Trump.",false,5
National gas price averages for regular fuel dropped below $2 per gallon during U.S. President Donald Trump's term of office.,true,10
Officials said President Biden had struggled for days over the move amid deep concerns about accelerating the already rapid rise in the price of gasoline.,true,3
"With Finland and Sweden likely to request NATO membership, and Ukraine counterattacking in the east, Russia’s invasion of Ukraine is facing more setbacks.",true,5
"In hosting major international sporting events, buying up soccer teams and even creating a golf league, the resource-rich Gulf States are seeking attention, prestige, economic diversification and political credibility.",true,11
"How to think about returning to the office, but not returning to office drama.",true,11
"A new collection of spices and condiments from Kamā, in Amman, Jordan, includes local variations on za’atar, tahini and chile paste.",true,2
“We allow toxic metals such as aluminum and mercury in shots”,false,3
"Mayor Eric Adams announced on Thursday that the city would take down the 84,400-square-foot facility and reopen a new migrant center in Midtown Manhattan.",true,11
Philip Wolfe makes his New York Times Crossword debut.,true,7
Jan. 6 defendants “are being held in prison without being charged.”,false,3
The prime minister is under intense political pressure over claims that he lied to Parliament about parties held in Downing Street during a lockdown.,true,1
John Fetterman's a self-described democratic socialist.,false,4
"Video of gas station in Tuban, Indonesia's East Java province, burned down by mob due to fuel price hike",false,9
Ukraine was the largest donor to the Clinton Foundation for 15 years,false,2
"Two men are charged with conspiring to kidnap Gov. Gretchen Whitmer. But a first trial ended with no convictions, and questions about the F.B.I.’s tactics.",true,8
"Will Swenson, the star of “A Beautiful Noise,” has come a long way from his days as an eighth grader wooing girls with his Diamond repertoire.",true,11
Americans are combining leisure and business travel. Tech profits are slowing. And the deadline for Elon Musk to buy Twitter is coming up.,true,10
Entrepreneurs are aiming to put A.I.-powered pet translation tools into our pockets.,true,8
The World Economic Forum organization has its own dedicated police force or paramilitary.,false,5
Employees of the social network will learn via email if they are out of a job — or if they will continue to work for Elon Musk.,true,11
"Destroyed tanks and body parts are all that are left of a Russian advance, part of the larger battle to block the invaders’ attempt to enter or encircle the capital.",true,3
"Elon Musk deleted a tweet where he called the Mastodon social media platform ""Masterbatedone.",true,11
“Tim Ryan when he ran for president two years ago … supported banning fracking both on public lands and generally speaking.”,false,10
Deceased bodies can get goosebumps.,true,4
"In an increasingly litigious conflict, the island’s residents are clashing over how to deal with the effects of climate change: Push back or accept what’s coming?",true,9
Many people who were NOT vaccinated also experienced zero or mild symptoms. Stop pushing the vax.,false,4
"In early March 2022, the United Nations banned its staff from using the word “war” in reference to Russia's invasion of Ukraine.",false,3
"$2,000 stimulus checks were due on Jan. 19.",false,1
"The 30-nation alliance had regarded Russia’s invasion of Ukraine as unstoppable just a month ago, but now sees the possibility of a Russian quagmire there.",true,3
"Pope Francis plans to meet with the head of the Russian Orthodox Church, Patriarch Kirill I, in September, the pontiff said in an interview with a Spanish-language broadcaster.",true,7
Raphael Warnock and Catherine Cortez Masto “voted to allow hundreds of millions of dollars of COVID relief funds” to be spent on leisure projects.,false,7
Burt Reynolds once dumped horse manure from a helicopter onto the National Enquirer’s Christmas tree.,true,1
Twitter officially announced the platform would be rolling out an edit button.,false,4
"Lyndon B. Johnson was Jewish, based on his maternal ancestry.",false,2
A teacher who survived the mass shooting recounts the harrowing attack and desperate wait for a rescue.,true,7
Meta reported its first-ever revenue decline. The Fed agreed on another supersize rate increase. And oil company earnings are booming.,true,7
Video shows residents breaking out of Covid lockdown in China’s Lanzhou,false,11
A photograph authentically depicts Melania Trump in lingerie posing with a shirtless Hunter Biden.,false,7
"Donald Trump Jr. tweeted, “While my father loves almost all his supporters, please do not come to Mar-a-Lago to support President Trump. We have many important people coming through the club and need to keep it clean.”",false,8
Ireland and Poland went in entirely opposite directions on abortion. Why?,true,9
"Guled Duran, a Somali, has been held in classified facilities since the C.I.A. took custody of him in 2004. He has never been charged with a crime.",true,1
A video shows pills growing into a snake-like form as they burn on top of a stove.,true,1
"Congress approved monthly inflation relief for those making under $50,000",false,12
"The fairy-tale musical, with songs by Stephen Sondheim, will feature Sara Bareilles and a cast of much admired theater performers.",true,5
"Certain medicines and compounds like folic acid “deplete folate, which is very serious for those with MTHFR”",false,2
"A star striker is eager to move to Barcelona, and his club doesn’t seem to realize it might be its own fault that he wants to go.",true,6
Alex Jones spent years accusing the family members of Sandy Hook shooting victims of being actors in a hoax and suggesting that their children were still alive.,true,9
New Zealand Prime Minister Jacinda Ardern said that the country's politics are less extreme than others' because Rupert Murdoch was never allowed to set up a media outlet there.,false,4
"President Biden, who has long advocated the expanded benefits, has speculated that his son Beau developed brain cancer because of exposure to burn pits when he served in Iraq.",true,8
"Lithium leach fields, such as the one shown in a viral photograph circulating in 2022, pose hazards to the environment and human health.",false,8
"“The facts are clear here. This is unbelievable. You have the wife of a sitting Supreme Court justice advocating for an insurrection, advocating for overturning a legal election to the sitting president’s chief of staff.”",false,3
"Pelosi security cameras malfunctioned during break-in, investigation over",false,10
Lipid nanoparticles in mRNA vaccines cause organ disorders,false,9
This word has appeared in 110 articles on NYTimes.com in the past year. Can you use it in a sentence?,true,10
"The economy was ""dead in the water when we got here. Virtually no jobs created.",false,4
The ousted civilian leader has been convicted on corruption charges by a military-appointed court. A Japanese journalist and two models have also been detained in recent weeks.,true,8
News story reported man was convicted in Georga Guidestones bombing,false,7
"No longer just for the flying elite, these havens from chaos are easier to get into now, with the crowds to prove it.",true,7
"Before the leak of a full draft opinion overturning Roe v. Wade in May 2022, there had never been a major leak to the press in a case before the U.S. Supreme Court in modern history.",false,5
"“If you wanted to kill a bunch of MAGA voters in the middle of the heartland, how better than to target them and their kids with this deadly fentanyl? … It does look intentional.",false,4
The Russian attack on a Mariupol maternity hospital was staged,false,3
A photo shows Ukrainian firefighters,false,3
"The Passaic County township attracts those seeking more affordable homes with easy city access. (And yes, an episode of ‘The Sopranos’ was shot there.)",true,12
"Retailers, keen to cash in on a Hallmark holiday, have been selling pink plastic trees and oversized conversation hearts to adorn them. Now they’re popping up on crafty corners of the internet.",true,2
“U.S. military arrests Michael Sussmann.”,false,6
Tricare will ship formula to military families,false,5
"There are no live television broadcasts in Russia, protest was staged",false,3
"The primary contest between Republican Representatives Mary Miller and Rodney Davis has pitted a hard-right figure styling herself in Trump’s image against a traditional, pragmatic conservative.",true,6
With online auctions there’s no accounting for taste — only paying a price for it.,true,3
Railing on social media from your blue state won’t change a thing down here.,true,7
“Naomi Biden says Joe Biden died four years ago.”,false,9
Witnesses said the flames spread rapidly. A video showed victims running from the building with their clothes ablaze.,true,8
"Hear tracks by Maren Morris, Stromae, Robert Glasper and others.",true,1
"“To be clear, Joe Biden is the ‘big guy.’",false,11
"“Pacific Gold,” the resuscitated survey’s 2022 edition, offers a revelatory look at fresh art in the region, but not without controversy.",true,10
Eric Kay had been convicted in February of contributing to the death of the pitcher Tyler Skaggs by providing him with opioids.,true,10
"The candidate, Derek Schmidt, is challenging Gov. Laura Kelly, a Democrat, in a changed political landscape two months after Kansas voters rejected an anti-abortion constitutional amendment.",true,10
Evidence that ivermectin works to treat COVID-19 is “powerful” and “overwhelming.”,false,3
A skin pinch test on the hand can be used to check for dehydration,true,12
"Bill Gates ""has been investing heavily in synthetic soy breast milk"" and is behind the baby formula shortage.",false,5
"U.S. President Joe Biden pinched a young girl’s nipple in 2015, according to video footage of the incident and the girl’s own claims on TikTok.",false,1
"Will Smith said, “Never underestimate the pain of a person, because in all honesty, everyone is struggling. Some people are just better at hiding it than others.”",false,4
"The cryptocurrency has risen 6.5 percent over the past seven days, bucking the trend as a strong dollar sinks other currencies.",true,9
"A day after the West Virginia senator scuttled plans to pass a climate and tax package, many in his party blamed him for the demise of their ambitions and expressed a lack of trust in him.",true,7
G20 leaders agreed to make vaccine passports and inoculations mandatory,false,11
"Tennessee banned Plan B pills and will impose a $50,000 fine on anyone who orders it",false,5
A video shows Russian jets flying over Kyiv,false,2
"Last year the IRS audited Americans earning less than $25,000 a year at five times the rate of other groups.",true,8
A machine must move 500 tons of earth to make one lithium car battery,false,8
Says Alexandria Ocasio-Cortez “says that all young people want to be socialists.”,false,1
"A photograph, shared widely in May 2022, showed U.K. Prime Minister Margaret Thatcher talking to a young Justin Trudeau, future prime minister of Canada.",true,5
Texas has its own state-run power grid.,true,6
Feeling stuck on today’s puzzle? We can help.,true,12
Overtime? Check. Game on the line? Check. N.C.A.A. tournament at stake? Check.,true,3
Wikileaks released footage showing that the moon landing was faked.,false,1
[Mark] Walker didn’t even vote to block a Democrat bill impeaching President Trump. Trump needed him. Walker abandoned him.,false,4
Pilots started training for sudden death during a flight in 2022,false,12
Prince Harry and Meghan Markle have signed divorce papers,false,6
The punishing selection course for the Navy’s most elite force has come under new scrutiny after a sailor’s death exposed illicit drug use and other problems.,true,9
"No corrections appeared in print on Monday, March 14, 2022.",true,3
He has said very little about how he will turn around Britain’s economy or deal with any of the other issues facing the U.K.,true,10
"His new memoir, “Waxing On,” sees the ’80s star making peace with the role that has brought him back into circulation thanks to “Cobra Kai.”",true,10
"Guns were banned at the NRA convention in Texas, specifically for the May 27, 2022, event at which former U.S. President Donald Trump was scheduled to speak.",true,5
"The last unit of the French military mission, Operation Barkhane, crossed into neighboring Niger, after a major fallout with Malian authorities.",true,8
Video shows Russian artillery tanks “completely destroyed by Bayraktar TB2 drones” on July 2.,false,7
“Biden impeachment in progress.”,false,7
Inflation was nonexistent.”,false,11
"In a Times/Siena survey, respondents’ concerns about democracy often diverged from typical expert analysis.",true,10
An implanted microchip in the body can replace vaccine cards and will be used instead to carry COVID-19 vaccine passports.,false,1
Apple cider vinegar and thermogenic supplements are effective for rapid weight loss,false,5
"When it comes to gift-giving, context is everything.",true,12
Bill Gates’ daughters aren’t vaccinated.,false,10
"Filled with hate, the screed describes a mass shooting at a grocery store and connects it with a belief shared by gunmen in previous massacres.",true,5
Obama vowed not to support Biden in the 2024 election and promised to vote for Trump,false,10
“Data from around the world suggests that omicron favors the fully vaccinated.”,false,1
Ballots found in Pennsylvania drop boxes show cheating in the election,false,10
"The settlement, which includes insurance companies, developers and other defendants, comes nearly a year after the tragedy killed 98 people.",true,5
"A picture shows Jeffrey Epstein associate Ghislaine Maxwell massaging the foot of Florida Magistrate Judge Bruce Reinhart, the man who signed off on the warrant that allowed the FBI to search Trump's Mar-a-Lago residence in August 2022.",false,8
Pelosi break-in involved a ‘hammer fight’,false,10
A shaken and emotional President Biden declared that it is “time to turn this pain into action” as he addressed the nation following the slaughter of 18 elementary school children and a teacher in Texas.,true,5
"In 1936, foresters planted California redwoods in Victoria. How long will they grow in peace?",true,3
Protestor who confronted police succumbs to injuries,false,4
"Two years in the making, this Tiffany & Co. necklace meticulously captures the shades and shapes of a wisteria.",true,8
Image shows young girl hurt in hit-and-run in locations around the world,false,12
An image shows rapper Biggie Smalls and singer Michael Jackson sitting together at a meal.,false,11
CNN tweeted a picture of a Serbian resort and said it was in Ukraine.,false,3
"Georgia Secretary of State Brad Raffensperger used ""$50 million of Zuckerberg money"" in 2020 to ""tip the scales.",false,5
“When President Biden took office … there was no vaccine available.”,false,5
"The lawsuits are the first by an American state against TikTok, which is owned by the Chinese company ByteDance, in a sign of mounting legal pressure.",true,12
Boston Children's Hospital is offering 'gender reaffirming hysterectomies' for young girls,false,8
"At 65, the British artist based in New York is in the Whitney Biennial and on the Turner Prize shortlist. Her sculptures blend strange and common items to make sense of the world.",true,5
“Leftist justice reform” is the reason that the NYC subway shooting suspect wasn’t in jail at the time of the attack.,false,4
"President Biden and European leaders say they cannot push Ukraine and Russia into negotiations, though some U.S. lawmakers are questioning aid for an open-ended war.",true,11
Democrats removed Nancy Pelosi from office,false,9
"Congressional Democrats gave the IRS funding that would allow it to ""extract"" $20 billion in ""higher taxes"" from “lower- and middle-income families.”",false,9
"Though some small galleries are opening or expanding, the mega dealers have closed shop, a blow to an area with a vibrant artistic history.",true,8
A little-known group at U.S. European Command in Germany fills Ukraine’s battlefield requests with donations from more than 40 countries.,true,7
Graphic shows banned conduct at the 2022 World Cup,false,10
It’s a season of renewal and abundance — and also farewells: Yvonne Rainer makes her last dance and Kevin McKenzie says goodbye to Ballet Theater.,true,9
There's a hotel room located inside Cinderella's Castle at Disney World in Florida.,true,12
"An old Christmas picture of Michelle Obama with cropped hair and masculine features standing with her future husband, Barack Obama, is an authentic photograph of the future first lady.",false,10
Brandon Koppy opens our solving weekend.,true,12
"Martin Luther King Jr. was 'killed by his doctor,' not a gunman",false,1
Weary migrants thronged a street in the manufacturing hub of Guangzhou to protest food shortages and lengthy stay-at-home orders under China’s strict “zero-Covid” policy.,true,11
“Third grade reading scores in the USA help correctional institutions predict how many beds they'll need in the future.,false,7
COVID-19 vaccine maker Moderna is a sponsor of the 2022 U.S. Open tennis tournament.,true,8
Tim Tebow used to “kneel in prayer and the NFL complained.”,false,1
Anti-government protesters disrupted Queen’s Jubilee celebrations,false,6
The album of music from the latest Disney animated film climbs to the top of the Billboard 200 after first arriving in November.,true,1
"U.S. carriers see no slowdown in demand, despite unease about the economy. But problems with staffing and operations are eating into profits.",true,7
"Many travelers removed their masks after a judge struck down a federal mandate for public transit. Health experts voiced concern, but President Biden said it was now up to individuals.",true,4
"The results are likely to be a source of national interest, with fiercely competitive races up and down the ballot.",true,8
PNC Bank locations won’t have coins starting in October,false,9
"The star of Amazon Freevee’s new comedy, “Sprung,” also confesses her public radio addiction and shows off her Edward Gorey tattoo.",true,8
