text,mergedTextualRating,month
"The slow evacuation may be part propaganda, part preparation for a conflict or part feint, Ukrainian and U.S. officials say. It could be all three.",true,1
The new Snapchat crying face filter is inspired by Amber Heard crying during her testimony about her relationship with Johnny Depp during their defamation trial .,false,5
Flurona is the latest variant of the coronavirus,false,1
Photos of leftist vandals thrashed over JNU anti-brahmin graffiti,false,12
"The region’s heat wave was expected to ease somewhat on Friday, with anticipated highs in the mid-90s.",true,8
Video shows a child swearing at Jill Biden during Diwali speech,false,10
Video shows trial for 'crimes against humanity' at 'World Criminal Court,false,2
"Five articles from around The Times, narrated just for you.",true,2
"The Long Island jury convicted Michael Valva of second-degree murder for killing his 8-year-old son, Thomas, who contracted hypothermia when he was made to stay in a freezing garage.",true,11
News clip showing Herschel Walker with early lead in Georgia U.S. Senate runoff is evidence of fraud.,false,12
Cleansing foot pads detoxify the body,false,4
A sweeping bill that would enact the strongest restrictions on Big Tech companies in the United States has been stalled in the Senate.,true,8
Ballots are “mailed unconstitutionally” to every voter in Colorado.,false,10
"American taxpayer dollars provide “free housing, free medical, free state identification” to immigrants in the country illegally.",false,1
"The muck is slowing Ukraine’s advance, but fighting remains intense in the east and the south.",true,10
"Florida lawmakers are reportedly working to resolve their political fight with Disney, just days after Mr. Iger returned as the entertainment giant’s chief executive.",true,12
"The CDC revealed that ""over 75%"" of all COVID-19 deaths ""occurred in people who had at least four comorbidities.",false,1
BLM protesters caused $2 billion worth of damage and faced no consequences,false,2
"Take on Bukhuti Gurgenidze in a recreation of a 24th U.S.S.R. Championship game in Moscow, 1957. Solve for the best series of moves.",true,8
Sheena Wagstaff revitalized the Met’s modern and contemporary art department and staked her legacy on experiments like the Met Breuer.,true,5
“Hillary is taken to Gitmo.”,false,2
96% of U.S. climate data is corrupted.,false,7
"The experimental comic is known for freewheeling sets. Then Bo Burnham asked, “What if you actually tried to make something?” The transition has been hard.",true,8
"A gorgeous snack drizzled with honey or a way to shuttle soups, stews or grilled meat from plate to mouth, this simple dish is the best kind of exercise in patience, Yewande Komolafe writes.",true,8
Says CNN reported Queen Elizabeth II died.,false,2
Chinese officer announced death penalty for not wearing a mask,false,3
Dead people always vote Democrat.,false,6
"Russian missiles hit a military base being used to train foreign volunteers who want to help Ukraine repel the invasion, killing a reported 35 people just 11 miles from the Polish border.",true,3
"Photographs accurately depicted world leaders at the 2022 NATO Summit visiting an exhibit with ""satanic"" artwork that featured gas masks and dead babies.",false,7
The last figure skating competition of the Beijing Games opened on Friday. The free skate is on Saturday.,true,2
"In 1963, Dutch businessman Alfred “Freddy” Heineken created a bottle that could also function as a brick to build houses in impoverished countries.",true,2
A law was passed in March 2022 permanently ending Daylight Saving Time in the United States.,false,11
"After months of repeated Russian strikes, Ukraine’s capital can no longer take electricity, water, heat, cell service or internet for granted. And the hum of generators is everywhere.",true,11
The judge’s order allows clinics to continue providing abortion services for now.,true,6
Player’s home in Cameroon attacked after Swiss World Cup goal,false,12
Sen. Mark Kelly “voted to legalize abortion up until the moment of birth.”,false,7
"A photograph shows a figurine of former U.S. President Donald Trump hanging on a cross behind U.S. Rep. Marjorie Taylor Greene, R-Ga.",false,7
Photo shows Rep. Adam Schiff and a “little boy he killed.”,false,12
Australian doctor told news programme that Queen Elizabeth II should use ivermectin to treat Covid-19,false,2
The Biden administration “is spending $30 million on crack pipes.”,false,2
"“In Arizona, we have flood the zone with fake ballots.”",false,8
"Face shields, Covid-19 tests, vaccine cards are required on election day",false,5
"A boy petted an unknown sea creature before realizing what it was and it ""shocked everyone.",false,1
"In a cover story for Vogue, Williams said she was “evolving away from tennis, toward other things that are important to me.”",true,8
"After micromanaging the coronavirus strategy for nearly three years, the country’s leader, Xi Jinping, has suddenly left the populace to improvise.",true,12
An extensive study published in the New England Journal of Medicine found that the most productive age in a person’s life is between 60 and 70 years old.,false,2
"“I’m just trying to get the hang of everything,” said Jamad Fiin, whose talents have upset people’s expectations of what a girl in a hijab can do.",true,8
"Parker Titsworth, a college football player for Ohio University, wears a jersey with the number 69 on it.",true,11
"A former archbishop of Bordeaux acknowledged that he had behaved “reprehensibly” with a 14-year-old girl over three decades ago, in the latest revelation to jolt Roman Catholics in France.",true,11
That the House panel did not provide the Justice Department with transcripts of Cassidy Hutchinson’s interviews speaks to the panel’s reluctance to turn over evidence.,true,6
"Disney theme parks have an ""Aladdin Exception"" rule that allows the actor portraying the character Aladdin to kill guests if absolutely necessary.",false,3
"Surveillance video from inside Robb Elementary School on May 24, 2022, showed a man in a protective vest marked ""Sheriff"" using hand sanitizer about an hour after the gunman entered the school and started firing.",true,7
“Finnish Court rules sex with children is permitted.”,false,4
"For months, the jail’s doctor has promoted the drug, which health experts say should not be used to treat or prevent Covid-19.",true,1
"It looked like another title might have slipped through its fingers, but Argentina, and its star, claimed the ultimate trophy.",true,12
Feeling stuck on today’s puzzle? We can help.,true,1
"Rev. Charles Stanley, an Atlanta pastor, endorsed CBD and keto oil and gummies.",false,7
The young American team came away with a scoreless draw against the 13th-ranked team in the world as it continues to tinker with its roster and tactics ahead of the World Cup.,true,6
The Transportation Administration Authority (TSA) allows immigrants living in the U.S. without authorization to use arrest warrants as government-issued identification at airport checkpoints.,false,3
A video shows a recent explosion in Ukraine,false,2
"Mentions of the phrase ""pregnant women"" were changed to ""pregnant people"" on a page about flu guidance on the CDC website.",true,11
"Karen Khachanov of Russia needed five sets to put Kyrgios away, 7-5, 4-6, 7-5, 6-7, 6-4. He will play Casper Ruud of Norway in the semifinals on Friday.",true,9
Answering a text message allows human traffickers to track your location,false,3
Video of men harassing Muslim women taken during Karnataka hijab row,false,2
"A black-and-white photograph taken in 1886 shows Jonathan, the oldest known land animal.",true,1
Video shows NASA astronaut Karen Nyberg in front of a green screen,false,9
Video shows crowd chanting “F--- Joe Biden” during Obama speech,false,10
"The Treasury Department is expected to let a sanctions carve-out lapse next week, raising the prospect of a Russian default.",true,5
"At the start of the COVID-19 pandemic, Judge Ketanji Brown Jackson advocated that “each and every criminal defendant in D.C. Corrections custody should be released.”",false,3
Video shows Elon Musk saying he intends to buy Meta,false,12
"Tesla told the federal regulator that rolling stops were allowed only at intersections when no cars, pedestrians or bicyclists were detected but agreed to disable the feature.",true,2
"In China, Russia and the United Kingdom, unmarked sheets of white paper have become a potent symbol of defiance.",true,12
"Commonly used to describe that extra something added to almost anything, the slang term has a centuries-long history.",true,1
Card balances have been rising rapidly. But there are ways to navigate the gift-giving season without taking on a lot of new debt.,true,11
The early playoff exit was a stunning end to a season that began with championship dreams behind Kevin Durant and Kyrie Irving.,true,4
CNN broadcast reported no evidence that plane crashed into Pentagon on 9/11,false,9
The former general seized power in a 2014 coup. The opposition had argued that the Constitution stipulated he leave office this year.,true,9
Vladimir Putin has banned the Rothschild family from entering Russia,false,2
"Etel Adnan avoids easy understanding or conclusion. She layers on complexity, and we are thrust into the magical unknown.",true,1
Ricky Ian Gordon’s “Intimate Apparel” and “The Garden of the Finzi-Continis” are premiering in New York almost simultaneously.,true,1
A video shows a waterpark slide launching participants into the air.,false,7
The company blamed its financial performance for the potential bonus cut.,true,8
"Police in Bowie, Maryland, arrested two white men who threatened to kill Black people at Walmart and Target stores in May 2022.",false,5
Stacey Abrams is facing criminal charges over activities of two nonprofits,false,12
"Sri Lanka’s leader, who fled the country on Wednesday, appointed Prime Minister Ranil Wickremesinghe as acting president “while the president is overseas,” the speaker of the country’s parliament said in a statement.",true,7
“Joe Biden uses the ATF to illegally track your gun transactions.”,false,2
"A plan to purchase up to 165,000 gasoline-powered mail trucks instead of electric models has angered Democrats and the Biden administration.",true,3
Three churches were targeted during arson attacks over the summer “because they protect unborn babies and women in need.”,false,8
A Russian businessman offered a $1 million bounty for President Vladimir Putin's arrest.,true,3
“The sun is not 93 million miles away … it is local and under a firmament dome.”,false,9
"Rock band Blink-182 named its holding company ""Poo Poo Butt, Inc."" because the members thought it would be funny to hear their managers, accountants, and attorneys say the name.",true,2
"In Mira Nair’s sweet, sexy film from 1991, an Indian American woman falls for a Black cleaner played charmingly, as ever, by Denzel Washington.",true,4
"Zouma, a defender who also plays for the French national soccer team, lost a sponsorship deal with Adidas on Wednesday after a video circulated online of him kicking his cat.",true,2
Video shows Nancy Pelosi crying after confrontation with Sen. Chuck Grassley,false,11
“We’re becoming aware that they’re everywhere.” An environmental researcher weighs in on the little particles that break away from the everyday plastic items in our lives.,true,12
Airplane toilets dump waste while the aircraft are in flight.,false,12
A video shows Nancy Pelosi unveiling a portrait of former U.S. Energy Department employee.,false,12
"Themes explored in next summer’s temporary exhibition may include diaspora, migration, displacement and civic gathering.",true,12
"As a Thanksgiving prank, cooks have stuffed their roast turkeys with Cornish game hens to convince gullible family members they were about to dine on a ""pregnant turkey.",true,11
"Ms. Barnes, senior vice president for news and editorial director at NPR, has also held leadership roles at the Houston Chronicle and Minneapolis Star Tribune.",true,11
"In January 2022, California substitute teacher Bridget Maas was fired or faced censure because she refused to accept a student's expressing their feline alter ego.",false,1
Russia hit the capital for the second week in a row.,true,10
"While voters are most focused on cost-of-living issues, the opposition Labor Party has made the election a referendum on the conduct of Prime Minister Scott Morrison.",true,5
"Lausanne has kept a night watch atop its cathedral since 1405, but it never appointed a woman to the role until Cassandre Berdoz, after a long fight, landed a job that was her “childhood dream.”",true,1
"Image shows BBC graphic that reports CDC has classified monkeypox as airborne, anyone within 15 feet can catch it",false,8
Video shows Clark County poll worker acting illegally by asking people to place their ballots into a bag outside of a drop box.,false,8
"The magazine’s Ethicist columnist on whether to keep a coworker’s illness confidential, outing an unvaccinated colleague — and more.",true,1
Brittney Griner is sentenced in Russia.,true,8
"Robert Crimo III, who's been charged with the Fourth of July mass shooting, is transgender.",false,7
Colorado Rep. Lauren Boebert shot and killed her neighbor's dog.,false,10
“Toothpaste is poisonous”; “fluoride is a neurotoxin” and doesn’t prevent tooth decay,false,4
Reports of excess mortality well into 2022 shows that mass vaccination against COVID-19 is responsible for this increase in deaths,false,11
"A serial killer has murdered nine women in San Antonio, Texas",false,12
"In May 2022, CNN reported that Kellogg's had announced the Rice Krispies mascot Pop ""is now a trans woman.",false,5
A plant exists that resembles a human/mammalian vagina.,true,11
"“Don’t listen to my Republican friends in Congress — last year, we reduced — my budget reduced the — the deficit by $350 billion.",false,4
"Some snow globes contain the antifreeze ingredient ethylene glycol, which is dangerous to pets.",true,12
Incidental COVID-19 hospitalization data proves that hospitalization numbers are inflated and that the situation isn’t as dire as health officials are making it seem.,false,1
Argentine boy who died at age 4 was part of a COVID-19 vaccination campaign,false,11
A push to renew the ban is so unlikely to succeed that one Democratic aide likened it to trying to jam the world’s biggest genie back into the world’s smallest bottle.,true,6
"Actor Mel Gibson said ""Hollywood is an institutionalized pedophile ring.",false,4
Feeling stuck on today’s puzzle? We can help.,true,10
Photos show flooding in China in 2022,false,7
"Some 91 minutes before stopping the shooter, one or more law enforcement officers went inside Robb Elementary School and rescued their own children.",true,5
"A line of thunderstorms brought violent winds that left a trail of damage across parts of Ontario and Quebec on Saturday, and hundreds of thousands without power.",true,5
The Atlantic published an article on 'The Heroism of Biden’s Bike Fall,false,6
"According to the Census Bureau, “5 million more people voted than were registered to vote” in the 2020 election.",false,3
“Pennsylvania judge allows ballots to count that are received up until November 14th.”,false,11
"The social media company’s 7,500 employees have been bracing for job cuts since Mr. Musk took it over last week.",true,11
"In her memoir, “I’m Glad My Mom Died,” McCurdy, best known for her role in“iCarly,” reflects on her time as a child actor and on her troubled relationship with her mother.",true,8
"Judge Ketanji Brown Jackson, who underwent Senate-confirmation hearings as a nominee for the U.S. Supreme Court in March 2022, presided over the “Pizzagate” case, in which a shooter targeted a pizzeria in Washington, D.C., in 2016.",true,3
The climate change and prescription drug law has revived a set of party goals that were widely thought to be dead.,true,8
The filibuster is “the tradition of the Senate here in 232 years now. … We need to be very cautious what we do. … That’s what we’ve always had for 232 years. That’s what makes us different than any place else in the world.”,false,1
"From in-person and virtual performances to exhibitions and tours, the city offers plenty of options for honoring the civil rights leader this year.",true,1
Rat meat is being sold as boneless chicken wings,false,1
The World Economic Forum has its own police force,false,5
A photo shows a Russian warplane under attack.,false,2
"Fowles, who played through pain in her final season with the Lynx, said she wanted to “step away and debrief a little bit.”",true,8
The Swedes lost the top medal to the United States four years ago.,true,2
"The mother of Uvalde, Texas, school shooting victim Amerie Jo Garza wrote and published on Facebook a poem that began: “The chicken soup in her thermos stayed hot all day while her body grew cold.”",false,6
One in five Americans bet on sports this year. Against most odds — my total lack of interest in all professional athletics — I was one of them. And I was hooked.,true,12
We have 85 million Americans who have no health insurance.,false,12
"Williams, along with her sister Venus, transformed the tournament grounds in Queens into a more inclusive environment.",true,8
The actress was never offered a period piece until “Mr. Malcolm’s List.” She was given 24 hours to decide whether to do it. Now she’s earning raves.,true,7
SpaceX CEO Elon Musk donated Starlink terminals to Ukraine following the Russian invasion in February 2022.,true,3
A new how-to guide aims to support the start-ups that are chugging along and doing just fine.,true,3
Lancet study showed that vaccinated people have lower immune function than unvaccinated people; COVID-19 vaccines suppress the immune system,false,7
Standouts like “All the Beauty and the Bloodshed” and “Descendant” are still on tap in the second half of this marathon of cinematic art.,true,10
"The Disney company is losing subscribers, visitors and stock value for opposing Florida’s “Parental Rights in Education” law.",false,4
"The word ""alcohol"" derives from the Arabic term for ""body-eating spirit",false,3
Measuring cup meme proves ice melt from global warming can't cause sea-level rise,false,6
They are literally chopping off the private parts of young kids.,false,8
"In subway stations and apartment buildings, artists are playing Bach, Vivaldi and folk songs.",true,3
Russian President Vladimir Putin faced an assassination attempt in September 2022.,false,9
Texas is distributing DNA kits to identify children in school shootings,false,10
The 650-mile-long Seversky Donets River originates in Russia and meanders southeast through the Donbas region before re-entering Russian territory.,true,5
"Archaeologists discovered a scroll in 1892 that led to the discovery that the Lord's Prayer, when properly translated from Aramaic directly into English, actually begins with the words, ""O cosmic Birther of all radiance and vibration.",false,8
"Ballots recovered from a Santa Clara County, California, ravine are evidence of “how the left cheats to win.”",false,11
"A Stockton, California, council member said “there’s a serial killer in Stockton.”",false,9
"The Wu Tsai Theater will honor a $50 million gift from Joseph Tsai, a founder of the Chinese e-commerce giant Alibaba, and Clara Wu Tsai, a philanthropist.",true,8
"After Novak Djokovic’s immigration troubles, he is gone, but don’t worry: Plenty of other stars and story lines are ready for the spotlight.",true,1
George Floyd and COVID-19 “never existed.”,false,7
"Hindu holy man, or sadhu, beaten by Muslim man in India",false,5
Poisonous hammerhead worms are invading the U.S. and can replicate when being cut into multiple pieces.,true,3
"If your children melt down, or the dirty dishes are visible behind you, does that mean your job performance is chaotic, too?",true,4
"“It was so shocking,” Jimmy Kimmel said. “The only thing I can really compare it to is when Mike Tyson bit Evander Holyfield’s ears.”",true,3
President Biden has taken pains to show that he understands there is a difference between what he calls extremist “MAGA Republicans” and other members of the Republican Party.,true,9
"The Infowars fabulist’s empire is only worth a fraction of the $1 billion he has been ordered to pay the families, and he won’t surrender it easily.",true,10
"After the league and the players’ union failed to reach a new collective bargaining agreement by M.L.B.’s self-imposed deadline Tuesday evening, the league said the season would not start on March 31.",true,3
"As China’s largest city struggles to contain a coronavirus outbreak, outrage erupted online after images circulated of small children isolated from parents.",true,4
Kenyans in Australia voting in polls at home,false,8
"Herschel Walker “is heavily funded by the oil and gas industry, raking in more than $140,000 in donations from Big Oil and other energy interests.",false,11
Tim Hortons’ CEO has been arrested for possession of child pornography,false,7
"As the pandemic rages on, the safest place to work out is at home. Here’s how to create a personal gym you’ll want to spend time in.",true,1
"Some of the cameras, from a climbing expedition 85 years ago, still had film in them. Conservators are looking to see if any images can be recovered.",true,10
A photograph shows an actual bottle of Funyuns Mountain Dew.,false,4
"Spencer Elden, who was pictured as a baby on the cover of “Nevermind,” argued in his lawsuit that the grunge rock group had engaged in “child pornography.”",true,9
There are U.S. biolabs in Ukraine funded by the U.S. government,false,2
"In this lesson, students will learn about the factors that may be contributing to a decline in mental health among teenagers and discuss what can be done to address it.",true,5
"For artists and designers accustomed to considering both form and function, working in miniature affords outsize opportunities for experimentation.",true,11
"The debate in Georgia between Gov. Brian Kemp, a Republican, and his Democratic challenger, Stacey Abrams, was structured to be heavy on policy — and that it was.",true,10
The Celtics have drawn confidence from previous season-saving wins. But watching a championship trophy drift away is another challenge altogether.,true,6
"The cryptocurrency exchange’s sudden collapse puts deals with teams, leagues and counties worth hundreds of millions of dollars in doubt.",true,11
"The private Russian military force, which has close ties to President Vladimir Putin and has been used in war zones across the world, is expanding its presence in Ukraine.",true,3
An image shows Rep. Marjorie Taylor Greene in front of a cross with a figurine of former President Donald Trump on it.,false,7
"Echoing Adolf Hitler's exact words from 1928, U.S. Rep. Marjorie Taylor said, ""We tolerate no one in our ranks who attacks the ideas of Christianity. Our movement is Christian.",false,8
"Embry Health, a leading coronavirus testing provider in Arizona, said it would suspend operations at 60 sites in the state and would no longer offer free tests for uninsured people, joining testing companies across the United States that have changed policies after the federal government said it could no longer reimburse providers for caring for Covid patients without insurance.",true,4
Domestic oil and gas production in the U.S. boomed in recent years. But the country and its allies remain reluctant to impose sanctions on Russian energy that would damage their economies.,true,2
Half of the votes for Joe Biden in the 2020 presidential election “are from dead people.”,false,8
The Great Sphinx of Giza in Egypt has shut its eyes.,false,5
President Biden flew to Rehoboth Beach in Delaware for a brief day of relaxation after a rebound case of Covid-19.,true,8
A student with three guns was caught at a Georgia high school,false,11
"The tennis star also said he had participated in an interview and a photo shoot even after testing positive for the coronavirus, in an apparent violation of rules in his native Serbia.",true,1
We reported alongside Ukrainians making their escape from Russia’s increasingly brutal invasion.,true,12
Video shows people handcuffed to do mandatory mass Covid testing in China,false,7
"Some users of digital wallets and e-commerce platforms must start reporting small transactions, sowing fears among small-business owners.",true,12
Becoming the focus of conspiracy theories about child sex trafficking has caused the National Butterfly Center to shut its doors for now.,true,2
The newspaper said his job would be to expand the section nationally and globally.,true,7
A photograph shows the Milky Way galaxy framed by the ancient Karnak temple in Egypt.,false,10
"David DePape, who is accused of attacking U.S. House Speaker Nancy Pelosi's husband, Paul Pelosi, on Oct. 28, 2022, had overstayed an immigrant visa and was in the U.S. illegally at the time of the attack.",false,11
Cancer rates have increased 20-fold since Operation Warp Speed,false,2
"Justice Sonia Sotomayor tested positive for COVID-19, according to Facebook post showing image with altered CNBC headline.",false,1
The chat groups in Los Angeles and Miami have become so popular that now there are waiting lists.,true,4
"The Honolulu home of Jean Charlot, a French expatriate artist, embodies his appreciation for the surrounding landscape.",true,8
Dr. Sanjay Gupta is selling CBD gummies according to a CNN webpage.,false,1
"Little was known about the shooting at the aerospace plant, but it came amid concerns about sabotage.",true,1
